https://www.imdb.com/title/tt0218839/reviews?ref_=tt_ov_rt,7/10,Well-acted character-driven comedy,Red-Barracuda,https://www.imdb.com/user/ur1616919/?ref_=tt_urv,12 January 2016,"0 out of 0 found this helpful. Was this review helpful? Sign in to vote.
Permalink",False,"This is Spinal Tap (1984) is in my humble opinion perhaps the greatest comedy film ever made. By making it so good, its creators simply set the bar so high, no one else  themselves included  have subsequently ever been capable of reaching its heights ever again. So it's not really much of a criticism in pointing out that Best in Show is not as good as Spinal Tap. It is a satire on the kind of people who participate in championship dog breeding. The events revolve around a gathering called the Mayflower Kennel Club Dog Show. There isn't really too much of a plot-line here, it's very much a character-driven comedy. It works because the actors in the ensemble cast are all adept at improvised comedy, so it's a film full of little moments rather than a major story arc.

Spinal Tap's Christopher Guest directs as well as acts in this one. He certainly has a feel for the mockumentary genre and has contributed to many of the best ones out there. I would probably describe Best in Show as amusing rather than hilarious though. There are a few laugh-out-loud funny moments though, such as the scene revealing the man with two left feet; while virtually every line uttered by the TV commentator played by the excellent Fred Willard is comedy gold. Truthfully, mixed in with the best material are some more strained jokes. However, as a whole, it works pretty well and the talented cast elevate the material when it falters on occasion. All-in-all, a solidly enjoyable movie."
https://www.imdb.com/title/tt0218839/reviews?ref_=tt_ov_rt,6/10,A good show. But not the best.,hall895,https://www.imdb.com/user/ur0915482/?ref_=tt_urv,25 September 2014,"0 out of 0 found this helpful. Was this review helpful? Sign in to vote.
Permalink",False,"It's another Christopher Guest mockumentary and with a cast full of certified comic geniuses it's hard to see how Guest could go wrong. Look at who Guest has at his disposal: Eugene Levy, Catherine O'Hara, Michael McKean, Parker Posey, Fred Willard. Is that enough? No? OK, let's toss in Jennifer Coolidge, Jane Lynch and Ed Begley, Jr. And of course there's also Guest himself as a key part of the ensemble. These are hilariously funny people. Which makes the fact that this is not a hilariously funny movie a little puzzling. Best in Show is funny but not outrageously so. A funny idea, certainly a funny cast, but not a consistently funny movie. There are a few really funny moments. But the movie ends up producing more wry smiles than big laughs. It leaves you wanting more.

The movie takes place in the rather bizarre dog show world. We focus on five dogs, and their inevitably strange owners, as they make the trek to and ultimately compete in the big dog show in Philadelphia. There's a guy who literally has two left feet and whose wife apparently has slept with every man on the planet. There's a campy gay couple and a neurotic yuppie couple. A trophy wife, married to an oblivious elderly man, and her lesbian dog handler. And an aspiring ventriloquist. All in all a weird bunch. At times perhaps a little too weird for the movie's good. A lot of strange things happen to these strange people. Some of these things are funny but there are a bunch of gags and jokes which fall flat. The movie perks up a bit when we finally get to the dog show itself. That is thanks largely to the presence of Willard who plays perhaps the world's worst television color commentator. He's clearly the funniest thing this movie has going for it. All the other performers do reasonably well but there are times where things just seem a bit off. Maybe the story doesn't quite work, maybe the characters aren't really developed properly. With all these great comic stars you expect hilarity and you don't really get that. The stars do the best they can with the material but you feel that the material let them down a bit. They all have their moments. Posey in particular does really well. And even in a film chock-full of performers with such notable reputations there's room for some lesser-known actors, such as Michael Hitchcock and John Michael Higgins, to turn in good work as well. There's just the sense that director Guest didn't quite pull it all together. This is a movie with such a great cast. That cast could have been put to a little bit better use. Best in Show had such great promise. But just as only one dog can win the trophy not every film is destined for greatness. This film falls a little bit short."
https://www.imdb.com/title/tt0218839/reviews?ref_=tt_ov_rt,7/10,Wacky characters in mockumentary,SnoopyStyle,https://www.imdb.com/user/ur2898520/?ref_=tt_urv,3 August 2014,"0 out of 0 found this helpful. Was this review helpful? Sign in to vote.
Permalink",False,"Christopher Guest and friends are now making a mockumentary on the dog show circuit. It's a whole bunch of wacky characters with their wacky problems and their wacky life. Everybody is doing a great job. Michael McKean and John Michael Higgins are the gay couple. Catherine O'Hara is married to Eugene Levy with his insane glasses. Parker Posey and Michael Hitchcock are an uptight couple. Jennifer Coolidge is married to an old geezer and Jane Lynch plays her trainer. There is a big problem in this movie. The separate teams have a hard time getting together because they don't really function as a team. They are separate and they stay separate. It limits their interactions and limits the possibility of comedy. It becomes a series of the characters separate and talking into the camera with wacky stories or having a wacky time. It's not until halfway through the movie that the characters start getting together as they prepare for the dog show.
0 out of 0 found this helpful. Was this review helpful? Sign in to vote.
Permalink"
https://www.imdb.com/title/tt0218839/reviews?ref_=tt_ov_rt,7/10,I could have sworn that was Christopher Guest as Harlan Pepper auditioning for 'The Cleveland Show'.,punishmentpark,https://www.imdb.com/user/ur24062644/?ref_=tt_urv,7 October 2013,"0 out of 0 found this helpful. Was this review helpful? Sign in to vote.
Permalink",True,"The mockumentary form by Christopher Guest: it's something I'm quite fond of - and I've seen a few. This is the second time I've seen 'Best in Show', and this easy going, but filled to the brim with funny little details semi-roadmovie is well worth a watch.

Lots of dialogue, lots of tricky relationships and individuals that are put under the looking glass, and with the clever writing of Guest, they all come up a little or more off, but that's the whole point of it.

Well played by Guest himself (I really thought he must have gone on doing 'The Cleveland Show' after that bit in the woods) and many of the mock-regulars, such as Levy, O'Hara (in 'For Your Consideration' she does a great 'botox', here she wags her leg like no other), Posey, Willard (an imprudent commentator once again) and Coolidge.

Good fun was had by all. 7 out of 10.
0 out of 0 found this helpful. Was this review helpful? Sign in to vote.
Permalink"
https://www.imdb.com/title/tt0218839/reviews?ref_=tt_ov_rt,8/10,An underdog that wins!,UnknownRealmsDotNet,https://www.imdb.com/user/ur7669580/?ref_=tt_urv,27 August 2012,"0 out of 0 found this helpful. Was this review helpful? Sign in to vote.
Permalink",False,"Dog shows -- one of the lamest and most pointless events that I can think of. Best in Show proves I'm not the only one to think so. With its zany, well-written characters, BiS makes watching snobbish dogs strutting around a hoot. All throughout watching this I felt the timing to the jokes was so perfect, the conversations were so dry and funny, that BiS reminded me of Spinal Tap. Low and behold this is not only written by Christopher Guest (the writer of Spinal Tap), but directed by him as well. And while there really is no story here, the jokes and timing are so spot on that this is too fun not to enjoy, thanks to Guest's writing and the ensemble casts' hilarious performances. Whether you are a dog fan our not, this is one dog show you can go nuts about. Very funny!
0 out of 0 found this helpful. Was this review helpful? Sign in to vote.
Permalink"
https://www.imdb.com/title/tt0218839/reviews?ref_=tt_ov_rt,,"Really, Truly, Basic Good Fun",jacklmauro,https://www.imdb.com/user/ur20495871/?ref_=tt_urv,7 November 2011,"0 out of 0 found this helpful. Was this review helpful? Sign in to vote.
Permalink",False,"I'll confess: I've been a fan since 'Guffman'. BIS delivers exactly as you hope it will, and Catherine O'Hara is always a treasure. So let's cut to the downside. In each mockumentary, Guest always takes it a little too far, and kills his own humor. For instance, in 'Guffman', it was absurd that Corky would end up owning a theatrical gift shop in NYC, but even more wrong was the 'Remains of the Day' lunchbox. It's a great joke but it's TOTALLY out of character - Corky would have no idea that this film existed. Just as, here, it is too surreal that a hotel clerk would offer a utility closet to a poor couple. It's not funny because Guest ventures beyond basic reality; aside from the ridiculousness of the clerk going so far to do this, it's insane that hotel liabilities would be overlooked. Yes, I know, this sounds picky, but a funny documentary MUST stay on earth to stay funny. Similarly, Cookie's past sex life is taken way too far, especially in the visit to the old BF. All of this would work beautifully if Guest would just keep his fantasy a little real. But: it's still a pip. See it.
0 out of 0 found this helpful. Was this review helpful? Sign in to vote.
Permalink"
https://www.imdb.com/title/tt0218839/reviews?ref_=tt_ov_rt,7/10,Decently funny and amusing,skullballmovies,https://www.imdb.com/user/ur21391900/?ref_=tt_urv,20 July 2010,"0 out of 0 found this helpful. Was this review helpful? Sign in to vote.
Permalink",True,"This isn't really one of those comedies that makes you crack up, it's one of those comedies that's fun to watch. Fred Willard was the highlight of the film being one of the commentators for the show and made me laugh with every line that came out of his mouth. Every character was defined and fun to watch but I disliked the couple with the braces. They would freak out over everything and it's supposed to be funny, but it really isn't, it just makes you feel bad that the dog has to go through that. The movie had a satisfying ending, where it wrapped everything up with every character. Overall, if you're wanting to see a different kind of comedy or you just want to spend an hour and a half exactly watching something amusing, check it out.
0 out of 0 found this helpful. Was this review helpful? Sign in to vote.
Permalink"
https://www.imdb.com/title/tt0218839/reviews?ref_=tt_ov_rt,8/10,"For some reason, I was rooting for the bloodhound.",TOMASBBloodhound,https://www.imdb.com/user/ur2326544/?ref_=tt_urv,14 March 2010,"0 out of 0 found this helpful. Was this review helpful? Sign in to vote.
Permalink",True,"Dog shows and the people involved with them would seem like a very inviting target for satire. And this effort by Christopher Guest and pals certainly hits the target, though it isn't quite a bullseye. Best in Show is a ""mockumentary"" about five show dogs and their often eccentric owners competing in what appears to be the Super Bowl of dogs shows in Philadelphia. More often than not it makes you laugh, and it certainly makes you feel sorry for the dogs in these kinds of shows.

Director Christopher Guest plays a redneck owner of an enormous bloodhound from North Carolina. This is obviously a lonely guy with maybe a few too many hobbies. We also see him as a ventriloquist, a guy who can name every kind of nut there is, and he even runs a bait shop. After the competition, he even takes a jaunt to Israel to work on one of those collective farms they have. Other contestants are a pampered standard poodle owned by a trophy wife and trained by her lesbian lover, one of a pair of tiny shi-tzus owed by a flamingly gay couple of guys, a shaggy terrier owned by a borderline white trash couple from Florida, and some other odd kind of dog owned by an annoying yuppie couple. The camera just seems to follow these people and their dogs around while the characters spout mostly improvised dialog as if they were really being interviewed instead of acting. Its good for a lot of laughs.

The redneck and the gay men get most of the laughs. Guest went to great depths to depict his Harlan Pepper character as a man with just too much going on in his own head and too much time on his hands. Michael McKeon and John Michael Higgins are good as the gay men. Maybe a little too good! Jennifer Coolidge (Stifler's mom for those of you American Pie fans) and Jane Lynch have characters that at least keep you guessing for a while about the true meaning of their relationship. I think I recognized the old codger who played Blue in Old School as Coolidge's husband! The film doesn't quite strike gold with the other two dog owning couples, though. Parker Posey and Michael Hitchcock are WAY too over-the-top as the yuppies. They could have been fitfully annoying without the tantrums. Catherine O'Hara and Eugene Levy are believable lower income Floridians, but the script overdoes it in ramming the point home about her promiscuity. And their dog seemed the least likely to win. Was this also some kind of joke? 8 of 10 stars.

The Hound.
0 out of 0 found this helpful. Was this review helpful? Sign in to vote.
Permalink"
https://www.imdb.com/title/tt0218839/reviews?ref_=tt_ov_rt,8/10,Five bizarre trips to a dog show where shameless pet owners rule the screen!,Marc_Israel_365,https://www.imdb.com/user/ur20531137/?ref_=tt_urv,26 October 2009,"0 out of 0 found this helpful. Was this review helpful? Sign in to vote.
Permalink",False,"Another esoteric ""mock-umentary"" by Christopher Guest for pet owners and the people who look at them cross eyed! The wildly inventive and talented crew (Eugene Levy, Maureen O'Hara, Michael McKeon, Parker Posey, Jennifer Coolidge, John Michael Higgins, etc.) of Guest directed films take control of their characters and bring them to places that are somewhat predictable but awkwardly funny none the less. We follow the humble and spoiled beginnings of various dog owners' trips to Philadelphia and throughout this farce of a pet show. This seasoned comedy troupe, who amazingly continue to create and deliver such diversely bizarre characters, have mastered the art of comedic improvisational acting! ""I'm going to wait here until I get another message.... from myself"".
0 out of 0 found this helpful. Was this review helpful? Sign in to vote.
Permalink"
https://www.imdb.com/title/tt0218839/reviews?ref_=tt_ov_rt,7/10,Dryly outrageous satirical humor...presented and performed with a loving bite,moonspinner55,https://www.imdb.com/user/ur0989035/?ref_=tt_urv,4 April 2009,"0 out of 0 found this helpful. Was this review helpful? Sign in to vote.
Permalink",False,"Philadelphia is home to the 125th Annual Mayflower Kennel Club Dog Show, which brings out several colorful couples and their prize pooches for competition (the prize, a silver cup, is big enough to take a sponge-bath in). Mockumentary extraordinaire! Endless pithy witticisms from actor-co-writer-director Christopher Guest, whose troupe includes some really marvelous talent, all of whom get a chance to shine here. Occasionally, the targets are flabby or obvious (lots of 'bitch' jokes and a labored marital spat over a squeeze toy), but otherwise this is right on target. The outr humor which coated Guest's ""Waiting For Guffman"" in 1996 (and had, at times, a sour residue) is toyed with here in a much more loving way. I got the feeling Guest genuinely liked this group of characters better than the ""Guffman"" bunch; and though he does poke and prod at them with his camera--and encourage his actors to go all the way with the material--the nimble editing never wears them out, and the picture does not overstay its welcome. *** from ****
0 out of 0 found this helpful. Was this review helpful? Sign in to vote.
Permalink"
https://www.imdb.com/title/tt0218839/reviews?ref_=tt_ov_rt,7/10,Some good fun to watch.,Boba_Fett1138,https://www.imdb.com/user/ur1416505/?ref_=tt_urv,15 March 2008,"0 out of 0 found this helpful. Was this review helpful? Sign in to vote.
Permalink",False,"If you like a more subtle comedy, this is a great movie for you to watch. It features a wide variety of a bunch of odd characters and a main story situated around a dog-show.

Well, to be honest, there isn't really much story in this movie actually. It's a fake documentary, or mockumentary, focusing on the world of dog-shows and their owners. The first halve of the movie mostly consists out of fake interviews with the characters about them and their dogs, while the second halve concentrates more on the travel to- and the actual dog-show. The movie is not always made credible as a fake documentary because of its way of filming, editing and overall story-telling, so the movie is more stuck somewhere between a mockumentary and just a subtle comedy. Not that this makes the movie any less fun to watch though. It's obvious director Christopher Guest tried to make his own ""This Is Spinal Tap"", a movie and early fake documentary he was involved with previously as an actor, song writer, composer and writer. He also does all of those things in this movie by the way and then some more as well.

It's obvious director and writer Christopher Guest let his actors do a whole lot of improvisation and gave them lots of room to play. At times he just lets the camera role and let the actors do their thing. They come up with with things at times as they just go along. Some of the actors handle this better than the others. I think this is because every actor is itself is very individualistic and want to do things their way, which is not always possible when the actors opposite you is having a monologue concerning the other actor opposite and all you can do is respond to it and just go along with the other actor. Some actors on the other do know how to handle this and go along perfectly with it, such as for instance Eugene Levy. Who must have really enjoyed his improvisations was Fred Willard, as the commentator of the big dog-show. Man, some of the stuff he says is absolute great and hilarious.

The characters and the sort of not everyday and sort of odd background story of a dog-show is what makes this movie work and fun to watch. It's a real subtle sort of comedy that doesn't try to be funny in a forced way but let the actors and characters be the center of the movie its comedy instead, without trying to make them look too funny and more real and humane like, despite all of their oddness's.

It's a fun in-between movie to watch, just like this was a fun in-between movie to make for the actors involved I'll bet.

7/10

http://bobafett1138.blogspot.com/"
https://www.imdb.com/title/tt0218839/reviews?ref_=tt_ov_rt,8/10,It keeps getting funnier...,movielovinjerseygirl,https://www.imdb.com/user/ur15661401/?ref_=tt_urv,14 January 2008,"0 out of 0 found this helpful. Was this review helpful? Sign in to vote.
Permalink",False,"every time I see it! There are many movies that get better with age, as well as, each viewing, but this one takes the cake. I never get sick of this film. Being able to watch it on satellite this evening after a lackluster day only reinforced that fact. Christopher Guest and Eugene Levy have created a cast of eccentric characters that rival any of the Coen brothers' creations. The casting is genius as are the actors' performances. The only thing that 'ruins' this film for me is Fred Willard. His buffoon to Jim Piddock's pained straight man is as sublime a combination as you will see. Fred basically steals the film. I always get angry with myself that I had forgotten to visit the bathroom before getting ensconced to watch and thereby have to waste time later. I could go on and analyze each character and their performance, but I am sure that has been done to death...yadda, yadda, yadda. In short, if you like offbeat, quirky comedies (sorry for the clich!), watch this film AFTER you go to the bathroom.
0 out of 0 found this helpful. Was this review helpful? Sign in to vote.
Permalink"
https://www.imdb.com/title/tt0218839/reviews?ref_=tt_ov_rt,,More Amusing Than Funny ...,Vic_max,https://www.imdb.com/user/ur5146276/?ref_=tt_urv,6 January 2008,"0 out of 0 found this helpful. Was this review helpful? Sign in to vote.
Permalink",False,"Although I think I only laughed once, I did find the zany caricatures of people interesting enough to cause me to watch through to the end. If you have seen any other Christopher Guest movies - this is typical of his style.

Basically, the story is about the behind the scenes activities and personalities of a group of dog show competitors. It done in the style of a interview-documentary.

The cast is broad and each set of dog owners has a different storyline going on. The choice of characters represented makes this movie amusing - there's a 40ish blond gold-digger married to the 80+ year old rich guy, an overzealous yuppie couple, an over-the-top gay couple, and more. A rich set of characters and their often embarrassing dialog gives this movie it's edge.

I recommend watching the first 5 minutes of this movie - it's completely representative of the remainder of the show. If you like the style and characters, then you'll enjoy this film.
0 out of 0 found this helpful. Was this review helpful? Sign in to vote.
Permalink"
https://www.imdb.com/title/tt0218839/reviews?ref_=tt_ov_rt,7/10,Best in Show a Good Show,view_and_review,https://www.imdb.com/user/ur3670492/?ref_=tt_urv,9 July 2007,"0 out of 0 found this helpful. Was this review helpful? Sign in to vote.
Permalink",False,"Who knew? I mean, who knew that a movie about a dog show could be so good? Now, of course the dog show itself was relatively insignificant and was only a small part of the movie, but it is what the entire movie was centered around. The movie was made by the characters though. Boy those were some funny characters. Even though I'm not a dog lover or owner, I've seen enough to know that some of those characters were spot on with their antics.

While I'm praising this movie, I would be remiss if I didn't give props to Eugene Levy for co-writing this movie. I didn't check to see if this was his first writing project, but this certainly was a good one for the old resume. Write on Eugene, this was a funny flick.
0 out of 0 found this helpful. Was this review helpful? Sign in to vote.
Permalink"
https://www.imdb.com/title/tt0218839/reviews?ref_=tt_ov_rt,8/10,Pretty good satire on 'dog people' and common issues,TBJCSKCNRRQTreviews,https://www.imdb.com/user/ur2093818/?ref_=tt_urv,12 March 2005,"0 out of 0 found this helpful. Was this review helpful? Sign in to vote.
Permalink",False,"When I sat down to watch this, I really didn't know what to expect, but I had spotted a good bit of small names in comedy on the cast list, so I thought 'what the hey, it might be good'. Turns out I was right. It's a great film, with plenty of commentary on dog lovers and various general issues(there is some great dialog between Eugene Levy and his wife regarding how much she dated before she met him... great stuff). The plot revolves around a dog show, and we see the various characters(read: dog lovers and friends) either going to it or talking about it. The acting is all very good, there really wasn't any performance I found anything less than satisfactory. The characters are well-written, credible and realistic, human. The dialog is real and funny. The dog lover stuff is funny, but possibly slightly clichd or stereotypical, but never overly so. I know I laughed every time a character talked to or about a dog as if it was a human being that could understand everything it was told, instead of simply an animal that is easily trained. The film is a treat for anyone who thinks animal lovers are somewhat ridiculous and/or any fan of any of the comedians and comic actors in the film. I recommend it to anyone who finds dog lovers particularly amusing and knows of(and enjoys) at least one of the actors in the film. 8/10"
