https://www.imdb.com/title/tt0218839/reviews?ref_=tt_ov_rt,6/10,Smiled--a lot; laughed--not as much,Jonny_Numb,https://www.imdb.com/user/ur1193248/?ref_=tt_urv,21 October 2006,"5 out of 9 found this helpful. Was this review helpful? Sign in to vote.
Permalink",False,"As with the ""Waiting for Guffman"" DVD, there are a good many deleted scenes to sift through on ""Best in Show"" (clocking in at nearly 30 minutes), most of which are pretty damn funny. After watching the film itself, I was left wondering why some weren't spliced into the finished product, since ""Best"" isn't nearly as good as ""Guffman"" or Christopher Guest's previous foray into 'mockumentaries,' ""This is Spinal Tap."" What we're left with is a fitfully funny, faux behind-the-scenes look at dog competitions with characters that lack the authenticity of the small-town performers in ""Guffman"" and the washed-up metalheads of ""Tap""--these people (down to Eugene Levy's 2 left feet and Parker Posey's braces) smack of artificiality. While the film is funny and ultimately satisfying for fans of Guest's observational brand of humor, I found myself smiling more than laughing at ""Best in Show.""
5 out of 9 found this helpful. Was this review helpful? Sign in to vote.
Permalink"
https://www.imdb.com/title/tt0218839/reviews?ref_=tt_ov_rt,,"Hilarious; does for dog shows what ""Spinal Tap"" did for rock groups",george.schmidt,https://www.imdb.com/user/ur0937743/?ref_=tt_urv,28 April 2004,"4 out of 7 found this helpful. Was this review helpful? Sign in to vote.
Permalink",False,"BEST IN SHOW (2000) ***1/2 Christopher Guest, Parker Posey, Michael Hitchcock, Eugene Levy, Catherine O' Hara, John Michael Higgins, Michael McKean, Patrick Crenshaw, Jennifer Coolidge, Jane Lynch, Bob Balaban, Don Lake, Jim Piddock, Fred Willard, Ed Begley, Jr., Larry Miller.

Christopher Guest is fast becoming one of the best mockumentary filmmakers with his latest triumph, a pointed take at dog show contestants and their addled owners.

The setting is the annual Mayflower Kennel Club Dog Show in Philadelphia which brings together some very memorable characters for competition. Included are in no particular order, all equally funny: Meg and Hamilton Swan (Posey and Hitchcock), the most obnoxious WASPs ever satirized on the big screen, whose `baby' Beatrice, is a purebred Weimaraner they dote on including extensive psychotherapy thanks to their dog witnessing their sexual antics; Gerry and Cookie Fleck (co-writer Levy and O'Hara, `SCTV' alums) who have unique characteristics as well: he literally has two left feet and she an apparent sexual history to rival Wilt Chamberlain, and their prized Norwich terrier Winky; gay couple Scott Donlan and Stefan Vanderhoof (Higgins - best known as David Letterman in HBO's telepic `The Late Show', and Guest's fellow `Spinal Tap'per partner in crime McKean), NYC hair salon stylists and their Shih Tzu they adore if not more than themselves; Leslie Ward Cabot and his decades younger trophy wife Sherri Ann (veteran character actor Crenshaw best remembered for his recurring appearances on tv's sitcom `Alice' and Coolidge, the sexy mom in `American Pie'), a buxom Anna Nicole Smith manque, whose standard poodle is represented byaward-winning handler Christy Cummings (Lynch eerily echoing Anne Heche), as a competitive not-so-secret lesbian lover of the bodacious and vacuous Sherri Ann; and finally Guest himself as the drawling North Carolina bred good ol' boy and fly fishing shop proprietor Harlan Pepper, sporting the most unusual shade of burnt sienna hair not unlike a Crayola and his beloved bloodhound, Hubert, who also shares a predelection for ventriloquism.

Along the way Guest allows his very talented cast of actors to improvise their way into uncharted hilarity skillfully skewering the vacant, pompous and ridiculous extents people will take to preen over their pets (like his previous films, Guest outlines a script rather than provide extensive dialogue and it clearly is his forte) oblivious to their grotesqueries.

There are so many side-splitting scenes from cuckolded Levy constantly being bombarded by frank sexual talk about his betrothed (particularly in a stop over to O' Hara's numerous exes, memorably played by a horny Miller); the anal retentive hotel manager portrayed by Begley (who accomodates from one extreme to the other but ultimately on the hygenic ways his staff will go to at lengths whenever the dog show is in town); to the flamboyant double entendres tossed by Higgins and his flashy clothing (8 count 'em 8 silk komonos for a 48 hour stint!). But hats off to Willard who steals the show as the event's color commentator Buck Laughlin whose inept improvisatory will have you laughing out loud and reveling on the nice riff he does of all those doofus sports announcers who think they know everything and kudos to his straight-man Piddock as Trevor Beckwith, who manages to implode with dignity.

Easily one of the funniest films of this year or in any year and it's always a pleasure to have a most welcome Guest as the host to showcasing limited talent so eloquently."
https://www.imdb.com/title/tt0218839/reviews?ref_=tt_ov_rt,9/10,Don't know much about dog shows? Don't care??,smalling_60626,https://www.imdb.com/user/ur8645461/?ref_=tt_urv,12 January 2006,"3 out of 5 found this helpful. Was this review helpful? Sign in to vote.
Permalink",True,"Doesn't matter. We are not talking ""mocumentary"" here. Christopher Guest remarked after making the first of his many wonderful satires, that if THIS IS SPINAL TAP were nothing but mockery, the film would have been over in fifteen minutes. And he was right. In BEST IN SHOW, Guest (and writing pal Eugene Levy) struck a kind of comic apotheosis; they don't mock AKC-type shows at all, but they have a wonderful time dishing up a fictional set-in-Philadelphia dog show to show the many off-center but All-American type dog owners and their interaction. Fred Willard plays the TV color man, whose every remark strives for wit but bespeaks a deep, deep ignorance of the topic (""The sporting dogs; those are the 'jocks' of the dog world, aren't they?"")

Perhaps it's Guest's British origin that gives him the required comic distance to craft a view so wonderfully skewed as in BEST IN SHOW. Certainly his many years in the USA give him great comic insight into the type of people whose foibles ""play"" in a movie. Parker Posey and Michael Hitchcock are the Swans, a couple of shrill perfectionist yuppies from suburban Chicago. Eugene Levy and Catherine O'Hare are the Flecks, a very typical middle-class couple from Ohio except that he has two left feet and she has round heels (a running joke in the film, as she is forever running across past lovers, to hubby's consternation). The ever-funny Jane Lynch plays a lesbian kennel owner with an eye for a rich man's wife (Jennifer Coolidge). Michael McKeon and John Michael Higgins are gay beauty-salon operators; the McKeon character could pass for straight but when Higgins' flames, he is a holocaust. And best of all, C. Guest himself plays Harlan Pepper (love that name!), a molasses-mouthed, low-key North Carolina hunter.

All I can do is sketch the players and open the way to the real treat of this movie: the comic dialog, much of it improvised. I would rather not deal with that here, because the lines and their delivery are the real spoilers and the reason this film transcends mere sketch humor and becomes something of a study in tragi-comic American types. Highly recommended. If you think American movie comedies have gone to the dogs, try this one; it's full of canines but there isn't a ""dog"" to be found anywhere in BEST IN SHOW!
3 out of 5 found this helpful. Was this review helpful? Sign in to vote.
Permalink"
https://www.imdb.com/title/tt0218839/reviews?ref_=tt_ov_rt,7/10,Grrrr! Woof!,=G=,https://www.imdb.com/user/ur0783721/?ref_=tt_urv,15 May 2001,"3 out of 5 found this helpful. Was this review helpful? Sign in to vote.
Permalink",False,"""Best in Show"" is a mockumentary spoof of one of those things which people do but which most outsiders can only view with raised eyebrows and quizzical looks askance: The championship dog show. This cute lampooning of the complete dog lover looks at a handful of stereotypes (gays, yuppies, a good old boy, etc.) and their pooches as they prep for, converge on, and participate in a dog show spectacle. A lively, clever exercise in over-the-top understatement.
3 out of 5 found this helpful. Was this review helpful? Sign in to vote.
Permalink"
https://www.imdb.com/title/tt0218839/reviews?ref_=tt_ov_rt,9/10,"Brilliant, Bright, and Biting Satire.",sofaqueen,https://www.imdb.com/user/ur28377181/?ref_=tt_urv,3 June 2014,"2 out of 3 found this helpful. Was this review helpful? Sign in to vote.
Permalink",False,"The world of dog shows is ripe for the picking, when it comes to mocking your subject and the characters that inhabit it's rings. But that is not really what Christopher Guest has ever done.

I watched this to remind myself what I love about this style of film. The characters develop naturally, by shedding layers of pretense when they ""don't know we are watching"" and suddenly pulling themselves together in a vain attempt to convince the viewer that we just caught them at a bad moment. It's a brilliant way to show us the lives of people on a mission. When you allow yourself to forget that you are watching a movie, and plunge into the documentation of these people's lives, you experience the sheer joy of being in on the joke, through the eyes of the camera crew. The behind the scenes workers who toil away on big budget films, and get to see the reality behind the surreal world of personas and personalities. Guest takes us deep into the lives of the ordinary person, who is trying to live an extraordinary life. This time, they do it through the dogs they own, or show.

They have dreams, and delusions, but the one thing you feel with Guest, that I appreciate now more than ever, is that he genuinely enjoys the human condition. He likes people. He cares about his audience, and he is in on the joke with us. We are not the butt of the joke, and we are never insulted for loving Dog Shows, Community Theater, or even the Rock Stars in a giant arena. Everybody loves a show, or to be a part of the show. NOT everybody gets to be a big star. To be the winner. To be noticed for what they feel is their unique gift or talent. Rather than exploit that, and ""mock"" it in a cruel and unfunny fashion, Guest reminds us that within our little circle, and in our own ways, we can all feel like stars. And it nobody has to get hurt in the process. I watched this film, in part, to recover from what I felt was an abysmal failure to make a Mockumentary style film about writers. Authors Anonymous. It fails where Guest shines. There are people acting their hearts out in old citrus warehouses, and others are packing up their RV's to head out to another dog show. These life stories, and their sometimes absurd details, make for hopeful films that salute the human spirit.

The spirit of competition is a theme Guest tackles with grace, and a divine objective ""everyone can be a star"" sensibility that pays homage to our desire to feel special, and rewards it at times, in the most delightful fashion. The underdog. That is what he brings us time and again, in new forms. This time, with actual dogs in the mix! Mock umentary should mean ""mocking the style of the documentary film"" Not mocking the people who are the subject of the film Even when the film is about insufferable boobs. We learn enough about them to begin to understand what makes them tick, what holds them together, and what causes them to come unglued. We end up caring.

Dog Shows are silly, but the people are far more complex. Dog shows are filled with pretentious snobs, in ""real life"" Easy prey. Not so easy to make a movie that works, much less can make us root for these people on any level, but he did it again. And is it ever fun to watch."
https://www.imdb.com/title/tt0218839/reviews?ref_=tt_ov_rt,9/10,A MUST SEE for EVERYONE!,cpelle,https://www.imdb.com/user/ur1438292/?ref_=tt_urv,23 June 2002,"2 out of 3 found this helpful. Was this review helpful? Sign in to vote.
Permalink",False,"This film was totally funny. I loved it. This is the best out of the three Guest films, the other two being 'Spinal Tap' and 'Waiting For Guffman.' My only complaint is that it should have been longer, for it is only 90 minutes. Having said that I wanted to see more, all that I did see I loved so much that I didn't feel ripped off. A-
2 out of 3 found this helpful. Was this review helpful? Sign in to vote.
Permalink"
https://www.imdb.com/title/tt0218839/reviews?ref_=tt_ov_rt,9/10,You have to see it.,cpelle,https://www.imdb.com/user/ur1438292/?ref_=tt_urv,22 June 2002,"2 out of 3 found this helpful. Was this review helpful? Sign in to vote.
Permalink",False,"No matter who you are, you just have to see this film. You'll especially LOVE it if you have seen ""Waiting For Guffman,"" except this is even more funny. The performances are excellent all around, and my only complaint is that it should have been longer. It is only and hour and a half. I saw a lot of comedies in 2000, but this one is the icing on the cake.

GRADE: A-

Parental Note: 11 and up.

The sick humor will go over the heads of most children this age, and those mature enough to get it can handle it.
2 out of 3 found this helpful. Was this review helpful? Sign in to vote.
Permalink"
https://www.imdb.com/title/tt0218839/reviews?ref_=tt_ov_rt,7/10,"Not 'Best of Breed', but still very funny.",BA_Harrison,https://www.imdb.com/user/ur0945066/?ref_=tt_urv,17 February 2018,"1 out of 1 found this helpful. Was this review helpful? Sign in to vote.
Permalink",False,"While not as brilliant or as quotable as This Is Spinal Tap, writer/actor/director Christopher Guest's character driven mockumentary Best In Show-which is centred on the world of dog shows-still has plenty of wonderful, well-observed moments of dry wit, and is one of those films that I believe can only improve with repeat viewings.

The film owes much of its success to its superb cast: Guest plays Harlan Pepper, redneck owner of a prize bloodhound; Eugene Levy is superb as buck-toothed Gerry Fleck, husband to Terrier owner Cookie (Catherine O'Hara), who has been around the block a lot more times than her dog; Michael Hitchcock and Parker Posey are the neurotic yuppie owners of a pampered Weimaraner; Jennifer 'Stifler's Mom' Coolidge plays Sherri, rich owner of a champion poodle, while Jane Lynch plays her lesbian dog trainer; and Michael McKean and John Michael Higgins play a camp gay couple who are showing their Shih Tzu. Meanwhile, Fred Willard shines as the hilariously un-PC co-host of the dog show, whose every remark is a howler.

7/10, but this rating may well go up in the future."
https://www.imdb.com/title/tt0218839/reviews?ref_=tt_ov_rt,9/10,Pure Bred.,aciessi,https://www.imdb.com/user/ur36246296/?ref_=tt_urv,29 December 2017,"1 out of 1 found this helpful. Was this review helpful? Sign in to vote.
Permalink",False,"No dogs were harmed during the making of this film. In fact, never has there ever been a film where dogs stayed so stoic in the face of a ton of foolishness. Best in Show, while on the surface a Christopher Guest mockumentary about competitive dog owners and over-the-top prestigious dog pageants, makes a particular comment on humans in comparison to animals. The humans make stupid decisions, overreact at things that don't matter, argue, scream and fight tooth and claw to win the blue ribbon, while the Dogs sit peacefully, seemingly unaware, or totally aware and choosing to ignore it.

Best in Show is a hilarious movie. The entire time, I had a big smile on my face. Guest has a knack for taking average situations and dissecting every peculiar aspect to poke fun of. He also knows the effortlessly unique qualities of middle Americans and how funny they actually are. Yes, these are seasoned improv comics portraying middle Americans, but in everyday life, you've seen these kind of people before. Take for instance, Harlan Pepper (played by Christopher Guest), a southerner who owns a fishing bait/tackle shop and talks incessantly about what he knows including every kind of nut in existence. Or, how about my personal favorite, the Flecks. Cookie Fleck (played by Catherine O'Hara) is the dutiful wife of Gerry Fleck, whose apparently slept with hundreds of men, quite literally, in fact, every man who comes in contact with her recognizes her. Her husband, Gerry Fleck (played by Eugene Levy) is the perpetual cuckold with two left feet, big bucked teeth and midwestern ""aw-shucks"" sensibility that everyone around him, especially his own wife, takes advantage of. Eugene Levy is the runaway stealer of the entire show. He's laugh-out-loud funny without even trying to be. He's the most natural improv comic in that he's entirely real in his delivery and knows how to react to awkward situation as we all would.

Best in Show is less about the dog's competing, as it is about the people. Guest puts them on display for us to decide who receives the blue ribbon. But dog lovers won't be disenfranchised, as the film proudly displays it's affection for these perfect creatures and how they never leave the side of their owners no matter how flawed they might be."
https://www.imdb.com/title/tt0218839/reviews?ref_=tt_ov_rt,,hilarious intelligent mockumentary,paranormalexplorer,https://www.imdb.com/user/ur75987388/?ref_=tt_urv,7 May 2017,"1 out of 1 found this helpful. Was this review helpful? Sign in to vote.
Permalink",False,"This movie is incredibly hilarious, the eccentric people and their dogs competing for the best in show is a great example of intelligent humor. Each of the dog owners and their dogs offered a unique story, and presented an insight into the psychological idiosyncrasies of pet ownership, and competition. And the different stories drew me in and made me curious to learn who would win.
1 out of 1 found this helpful. Was this review helpful? Sign in to vote.
Permalink"
https://www.imdb.com/title/tt0218839/reviews?ref_=tt_ov_rt,9/10,Fun movie about owners of dogs.,sltmjones-858-466161,https://www.imdb.com/user/ur48478996/?ref_=tt_urv,10 July 2016,"1 out of 1 found this helpful. Was this review helpful? Sign in to vote.
Permalink",False,"If you want good comedy and a chance to see the funny interaction of people and their dogs, you must watch this. The portrayal of the owners is so clich as it matches the idea some people may have already established about how far people will go in their treatment of their pet. Of course, the dogs are portrayed as ""normal"" while the personality of the owners is on the borderline of obsessed. Very entertaining and a great movie for the whole family. It will bring a smile to your face!

Besides being a movie about dogs at a dog show, it focuses on the personality of the owners and their crazy lives, which are embellished to the point of comic ridiculous.

Great for the whole family.
1 out of 1 found this helpful. Was this review helpful? Sign in to vote.
Permalink"
https://www.imdb.com/title/tt0218839/reviews?ref_=tt_ov_rt,6/10,Best in Show? Not Quite.,evanston_dad,https://www.imdb.com/user/ur4532636/?ref_=tt_urv,23 July 2010,"1 out of 1 found this helpful. Was this review helpful? Sign in to vote.
Permalink",False,"""Waiting for Guffman"" may just be my favorite comedy of all time; hardly a scene goes by without a dozen hilarious little lines and moments. It would, therefore, have given me nothing but pleasure to report that ""Best in Show,"" the first of Christopher Guest and ensemble's attempts to recapture the blissfully goofy chemistry of that earlier effort, was a rousing success. Unfortunately it's not. There are quite a few amusing moments, but the film never inspired in me much beyond a modest chuckle.

Mostly to blame, I think, is the fact that Guest enlarges his ensemble too much, with the result that no one really has enough screen time to create full characters with personalities of their own. The film feels much more episodic, and the actors even more than in ""Guffman"" play caricatures rather than people.

Still, these complaints will probably only pose a problem -- or at least problems to the same extent -- if you are as much a fan of ""Guffman"" as I am to begin with.

Grade: B"
https://www.imdb.com/title/tt0218839/reviews?ref_=tt_ov_rt,,Funny moments don't outweigh boring!,bigowl20022002,https://www.imdb.com/user/ur2306999/?ref_=tt_urv,27 July 2003,"1 out of 1 found this helpful. Was this review helpful? Sign in to vote.
Permalink",False,"Couldn't wait to see this as I am a big fan of dogs and not a fan of dog shows.... However after watching the whole thing I was very disappointed. Granted there were some funny even brilliant moments but alas it was momentarily while the dragging on was like the RV trip... Trying hard to be funny but falling very flat. If you have nothing else to watch go ahead but if you want to see dogs rent anything from Lassie to Benji and have more fun.
1 out of 1 found this helpful. Was this review helpful? Sign in to vote.
Permalink"
https://www.imdb.com/title/tt0218839/reviews?ref_=tt_ov_rt,7/10,An awesome display of directional improve,slapnutz1,https://www.imdb.com/user/ur1306133/?ref_=tt_urv,25 August 2002,"1 out of 1 found this helpful. Was this review helpful? Sign in to vote.
Permalink",False,"Best in Show definetly deserves the ""blue ribbon"". Completely improved, the movie is an outstanding display of the actors true comedic talents.

Best in Show was filmed without a script using only ideas to shape the direction of the film. Many takes and hours of footage leave the viewer completely satisfied and laughing out loud.

Each character is finely crafted and unique especially the characters played by SCTV graduates Eugene Levy and Catherine O Hara. This film allows both actors to display their talents.

The film includes all the regular Christopher Guest regulars and is clearly a film that fans of Spinal Tap and Waiting for Guffman can enjoy.
1 out of 1 found this helpful. Was this review helpful? Sign in to vote.
Permalink"
https://www.imdb.com/title/tt0218839/reviews?ref_=tt_ov_rt,,Enjoyable,DevilsOF13,https://www.imdb.com/user/ur1846193/?ref_=tt_urv,25 July 2002,"1 out of 1 found this helpful. Was this review helpful? Sign in to vote.
Permalink",False,"I recently watched ""Best in Show"" on the advice of a few of my friends who thoroughly enjoyed the movie. The flow of the film is very interesting. The beginning is very much like watching a documentary similar to those on cable channels like E! and the end flows more like a traditional motion picture (other than the final interviews, of course). Overall, I can't complain about my viewing experience, which though it seemed to drag at times (like most documentaries do), went by much more quickly and painlessly than I would have thought. The plot and script are pretty predictable, but the storyline follows exactly how it should, however expectable it may be. The dialogue is held together by countless (and hilarious) one-liners that can entice a chuckle out of the audience...even those members who have seen the movie many times. I loved the roles of Hamilton and Meg Swan as well. I think that more than anyone else, they demonstrate how serious some take competitive dog showing. Good, funny flick. Not great, or groundbreaking in any way, but fun to watch and worth a rent. 7 out of 10
1 out of 1 found this helpful. Was this review helpful? Sign in to vote.
Permalink"
https://www.imdb.com/title/tt0218839/reviews?ref_=tt_ov_rt,,Slightly peevish commentary on the film,jodi_the_bold,https://www.imdb.com/user/ur0887977/?ref_=tt_urv,9 November 2000,"1 out of 1 found this helpful. Was this review helpful? Sign in to vote.
Permalink",False,"A true fan of Waiting for Guffman and This is Spinal Tap, I was enthralled to hear of the US release of Best in Show. I deliberately avoided reading advance press, fearing I'd read overmuch into comments and references from other media. Now I almost wish I'd waited for it to come out on DVD. Best in Show was cleverly filmed, but it left me ambivalent about whether I'd lost or invested 1.5 hours.

The banality of the yuppies-mit-braces was pretty surprising. At the end of the film, I didn't believe for a *second* that they'd ever even heard of the Kama Sutra, much less practised it behind unlocked doors. The sum of narcissism, projection and earth tones isn't humor - adding the bland (smug? ""freaked-out""?) weimeraner isn't terribly funny, either.

Where did Leslie go? Wherefore? The sexual politics involved in this relationship are only intermittently provocative or funny. There's an old-ish SNL skit about a Loni Anderson liking soup - if it's come to the point of Christopher Guest offering homage to anything on NBC, I'm sad.

Happily, Guest's caricatures were handled gracefully. The Pine Nut native is treated with dignity, which is rare in a country rife with ""you're a redneck if..."" jokes. A sight gag involving a weird appendage only receives fleeting attention; likewise, Cookie's hoydenish past doesn't seem gratuitous. The gay couples aren't painted with too wide a brush - flamboyance is matched nicely with moments of genuine caring interaction and intelligent interplay.

If you're priding yourself on being edgy, stay home and watch Spinal Tap again. Branch out and rent Pi. If, however, you want a not-too-threatening-periodically-smirking movie to take up a bit of your wallet, go ahead and see Best in Show."
