https://www.imdb.com/title/tt0218839/reviews?ref_=tt_ov_rt,,**** Funniest movie of the year,Bil-3,https://www.imdb.com/user/ur0316001/?ref_=tt_urv,28 March 2001,"0 out of 0 found this helpful. Was this review helpful? Sign in to vote.
Permalink",False,"Christopher Guest outdoes his Waiting For Guffman with this absolutely hysterical film about dog competitions and the people who compete in them with their pets. A perfect cast, from Parker Posey to Catherine O'Hara could never be beat, and the writing (based on improvisations by the cast) is amazing. One of the very funniest comedies of the year.
0 out of 0 found this helpful. Was this review helpful? Sign in to vote.
Permalink"
https://www.imdb.com/title/tt0218839/reviews?ref_=tt_ov_rt,10/10,One of the funniest movies of 2000-2001.,Latinhouseparty,https://www.imdb.com/user/ur1109534/?ref_=tt_urv,21 March 2001,"0 out of 0 found this helpful. Was this review helpful? Sign in to vote.
Permalink",False,"I have been a fan of the directors work since Spinal Tap (he played lead guitar), and this movie continues his tradition of making fun of ridiculous behavior we accept everyday. The dog owners are insane and their lives petty. They feel like they are on a higher level than other people because of their well bread dogs. In reality most people could careless and the obsession with their pets only makes them appear strange to the out side world.
0 out of 0 found this helpful. Was this review helpful? Sign in to vote.
Permalink"
https://www.imdb.com/title/tt0218839/reviews?ref_=tt_ov_rt,9/10,Laughs from beginning to end.,keithmiller_se23,https://www.imdb.com/user/ur1097317/?ref_=tt_urv,12 March 2001,"0 out of 0 found this helpful. Was this review helpful? Sign in to vote.
Permalink",False,"It's great to see a comedy that has real jokes and not just wise-cracks. Each character was brilliantly written and portrayed. Even days afterwards I find myself laughing at some of the lines. I reccommend seeing it twice. There's too much good stuff to take in in one viewing. Even the dogs seem to be given a deadpan almost Buster Keaton like performance.
0 out of 0 found this helpful. Was this review helpful? Sign in to vote.
Permalink"
https://www.imdb.com/title/tt0218839/reviews?ref_=tt_ov_rt,9/10,Hard to stop laughing,Tigger77,https://www.imdb.com/user/ur0077805/?ref_=tt_urv,11 March 2001,"0 out of 0 found this helpful. Was this review helpful? Sign in to vote.
Permalink",False,"WHat a fun movie to watch!! The dogs are very cute and look like they are having a swell time. The characters certianly cover as wide a variety as their number. And the announcer perhaps the best lines and unfortunately was like so many announcers--completely taken by himself and ignorant of the event he was there to announce. Everyone in the audience laughed and at different lines which made it even funnier. Well worth renting!
0 out of 0 found this helpful. Was this review helpful? Sign in to vote.
Permalink"
https://www.imdb.com/title/tt0218839/reviews?ref_=tt_ov_rt,,Who are we really laughing at?,Jim-500,https://www.imdb.com/user/ur0451644/?ref_=tt_urv,20 February 2001,"0 out of 0 found this helpful. Was this review helpful? Sign in to vote.
Permalink",False,"Best in Show follows a group of people whose dogs are competing in a championship dog show. The movie is a ""mock-umentary""; that is, it's staged as if it is a documentary complete with interviews with people living their real lives. In writing this review, I found myself grappling with the task of defining a mockumentary. This is my best effort: In standard movies, we know that the people on the screen are actors playing characters. In a documentary, we know that the people are real people, not actors or characters. A mockumentary combines the two: the people on the screen are actually actors, but the characters they play are people living real lives. So the difference is that in real movies, we know that the characters are not real people. In mockumentaries, we are led to believe that the characters are real people, but we know that they're not. Perfectly clear, right?

So why is a mockumentary funny? Surely we can laugh at the real people around us, but we may do so cautiously for fear of hurting their feelings. A mockumentary is enjoyable because it lets us off the hook; we can freely laugh at these real people, because we know they're actually not real people, but merely portraying real people with all of their shortcomings.

Although the premise may be complicated, the joke isn't. Best in Show simply displays the foibles of several types of people when they are placed into an artificial situation. Literally every scene delivers a healthy giggle at the least, all the way up to true belly laughs. The show is in reality a McGuffin that lets us observe human silliness. There is the striving, hard-nosed young woman who has chosen winning dog shows as her life's work. There is the decent, sweet-hearted country boy who thinks he may be smarter than he really is, but if he isn't, that'll be okay with him. There is the thirty-something couple who place great and equal value on designer catalogues and dog toys. There is the middle-aged couple who are at once dim bulbs but who also have a lot of love for each other, awkward though it may seem. And there are the two outwardly gay men who know how to work together as a caring couple, and who aren't afraid to be their own goofy selves in public simply to enjoy their lives.

We also meet the show's broadcast host, who is a perfect portrayal of every media type who exudes enthusiasm but does so only because it's his job; he actually has no clue as to what is going on, nor does he care. And he has a trusty color commentator who is a dog show expert; we know he's an expert because he has a British accent.

Much of the comedy has nothing to do with the show. Catherine O'Hara's past love life surfaces consistently, much to her loving but perplexed husband's dismay. Ed Begley, Jr., as the manager of the hotel where the contestants are staying, cares so much about his clients that he will do anything to keep them from not having a room. Larry Davis has a small role as a man whose job it is to talk down people who have climbed tall buildings; we get to see him in action and understand why his success rate is on the smallish side.

The heart of this comedy is the fact that while all of these folks may fail to measure up in one way or another, we know that they're not bad people; they just act the way we all do. Sometimes our hearts and emotions get in the way of actually doing something important. Best in Show warms because that while we may fear looking silly, we innately know it's not a bad thing. While we fail most of the time and can look foolish while we're at it, at least we tried and did so with good intentions. Have you ever been at a party or convention and attempted making small talk with a group of people you didn't know and didn't care about, and make it sound meaningful? You'll have plenty of opportunities to laugh at yourself in this movie.

A final note: the winner of the show was the only person who really looked like they were walking their dog."
https://www.imdb.com/title/tt0218839/reviews?ref_=tt_ov_rt,,The dog world will never be the same again.,ferguscoe,https://www.imdb.com/user/ur0891265/?ref_=tt_urv,7 October 2000,"0 out of 0 found this helpful. Was this review helpful? Sign in to vote.
Permalink",False,"The dog world will never be the same again after the success of Best In Show. Nothing has captured the spirit and fun of the world of the dog fanciers like this film. As a Former breeder and owner/handler, (those people dumb enough to show their own dogs in a violently, political dog-eat-dog world) I could not stop laughing throughout the film. As if the characters' lines were not hysterical enough - the facial expressions of the actors said it all. The only stereotypes that were missing were the slightly loaded judge and the obvious, obnoxious power plays that take place in the ring. They should definitely be included in Best Of Show Part II. If you loved this film you will also love a new book that is out entitled: ""When Pets Come Between Partners"" by Joel Gavriele-Gold. A shrink takes a look at all the ways we ""use"" our pets to avoid dealing with our own psychological issues. I'm sure Gavriele-Gold would have given anything to have Gerry and Cookie Fleck in his office. A great film and a great read.
0 out of 0 found this helpful. Was this review helpful? Sign in to vote.
Permalink"
https://www.imdb.com/title/tt0218839/reviews?ref_=tt_ov_rt,10/10,Christopher Guest -- Genius!,moop,https://www.imdb.com/user/ur0613242/?ref_=tt_urv,13 February 2001,"0 out of 0 found this helpful. Was this review helpful? Sign in to vote.
Permalink",False,"While not quite as hilarious as ""Waiting for Guffman,"" Christopher Guest's follow-up is a heavily-improvised, gut-busting look at dog shows. While Guest often receives praise for his writing and directorial skills, his skills as an actor are phenomenal. The roles Guest played in ""Spinal Tap,"" ""The Princess Bride,"" ""Waiting for Guffman,"" and, now, ""Best in Show,"" are as varied as four roles can be. I sincerely hope he continues to create movies for years to come.
0 out of 0 found this helpful. Was this review helpful? Sign in to vote.
Permalink"
https://www.imdb.com/title/tt0218839/reviews?ref_=tt_ov_rt,7/10,Enough Laughs To Recommend This Original Comedy,gitrich,https://www.imdb.com/user/ur0073800/?ref_=tt_urv,9 January 2001,"0 out of 0 found this helpful. Was this review helpful? Sign in to vote.
Permalink",False,"Best In Show is original to be sure. I had several good belly laughs which prompts me to recommend it. The characters in this film are memorable and I found myself laughing at different scenes after I left the theatre. It is a spoof on dog shows in general , especially the dog owners. The characters range from a Gay couple to a Lesbian couple to a hound dog lover and so on. The last 30 minutes you will enjoy the final awards given to the best dogs narrated by, a funnier than usual, Willard Scott. An hour and a half is perfect for this movie. You should know that there are many scenes that are simply not funny. If you can wade through those, you will be rewarded many times throughout the film. If you love dogs, you will probably like the movie even more. I gave it a 7 out of 10.
0 out of 0 found this helpful. Was this review helpful? Sign in to vote.
Permalink"
https://www.imdb.com/title/tt0218839/reviews?ref_=tt_ov_rt,7/10,Definitely worthy of the blue ribbon,mlevy76,https://www.imdb.com/user/ur0958420/?ref_=tt_urv,7 January 2001,"0 out of 0 found this helpful. Was this review helpful? Sign in to vote.
Permalink",False,"I saw this film without ever having seen Waiting for Guffman. After seeing this, I definitely am hooked on Guest's wonderfully bizarre and hilarious mockumentaries. The actors were all hilarious portraying various dog owners bringing their prized pets to the fictitious Mayflower Dog Show. But more than anything, Fred Ward made this movie. His role as the show's commentator was one of the funniest performance of 2000(albeit, a lean year for comedies and movies as a whole). This is not to take away from the rest of the cast, who all were phenomenal. Definitely worth you're film dollar.
0 out of 0 found this helpful. Was this review helpful? Sign in to vote.
Permalink"
https://www.imdb.com/title/tt0218839/reviews?ref_=tt_ov_rt,9/10,"Genuinely clever, daring work.",denrus,https://www.imdb.com/user/ur0222539/?ref_=tt_urv,3 January 2001,"0 out of 0 found this helpful. Was this review helpful? Sign in to vote.
Permalink",False,"Another genuinely clever, daring work by Guest. If the Academy Awards would recognize a comedy category, this is the winner. This is the pinnacle in the Spinal Tap, Waiting for Guffman, Best in Show trilogy. Outstanding performances by the leads. Study them carefully. These are all people you know...and their dogs. I suggest Guest next tackle the subject of politics. His work has a cruel, yet functional honesty about it.
0 out of 0 found this helpful. Was this review helpful? Sign in to vote.
Permalink"
https://www.imdb.com/title/tt0218839/reviews?ref_=tt_ov_rt,9/10,Laughed from beginning to end,howard-30,https://www.imdb.com/user/ur0398791/?ref_=tt_urv,6 January 2001,"0 out of 0 found this helpful. Was this review helpful? Sign in to vote.
Permalink",False,"Characters are well crafted and hit the bulls-eye for satire. Couldn't stop laughing fr 30 minutes after it ended. The actors are first rate. Would recommend it to anyone. Expect to see it more than once more. The dog show itself was very well done and even seemed realistic which added to the humor.
0 out of 0 found this helpful. Was this review helpful? Sign in to vote.
Permalink"
https://www.imdb.com/title/tt0218839/reviews?ref_=tt_ov_rt,7/10,"Quirky comedy, fun for dog lovers.",capndawg,https://www.imdb.com/user/ur0980039/?ref_=tt_urv,25 December 2000,"0 out of 0 found this helpful. Was this review helpful? Sign in to vote.
Permalink",False,"Filmed in the mockumentary style of Waiting for Guffman, Best in Show is a very good film. Its stylistic acting (like Guffman) and a cast including many of the same actors are a tribute to Christopher Guest and his direction.

Guest himself provides the greatest acting contribution to the film in his portrayal of Harlan Pepper, a very human yet highly comedic character. Eugene Levy and Fred Willard deserve mention; the rest of the acting was on par, but not much more. Eugene Levy, the perennial character actor, plays a role that we've seen a variation of on other occasions, but plays it well with quirks that I've not seen him play.

Joseph T. Garrity and Monique Prudhomme (the production designer and costume designer respectively) were integral in the mood of the film as it looked like a documentary (thank you Garrity) and the costumes were comic, but realistic (thank you Prudhomme).

One thing that has always bothered me about film was the notion of a continuity error and there is one that I could not overlook in this film. Aside from one major continuity error, the editing was good overall.

Now I come to the thing that bothered me most about this film; admittedly, it is something that should not have bothered me: my expectations. I expected to walk into the movie house and not stop laughing until I came out much like I did when I saw Waiting for Guffman; however, I didn't find it nearly as funny. Perhaps that is because I work in the theatre, perhaps because I've never owned a dog. Consider this a warning, though. Don't go into the theatre expecting to see a ""sequel of Waiting for Guffman,"" as I've read many times, expect to see a movie in a similar style on completely different subject matter with completely different characters.

Also bothersome, was the depth (or lack thereof) of most of the characters. I found most of them to be caricatures rather than human beings. However, I heard the woman behind me say that she liked all of the characters as people, so perhaps it's only because I haven't ever known anyone who has participated in a dog show.

In order to not end this review on a down note, I'd like to point out that I do recommend this film to anyone. Perhaps dog owners will appreciate it more, but it is a film that you should see."
https://www.imdb.com/title/tt0218839/reviews?ref_=tt_ov_rt,10/10,A truly original comedy that will have you doubled up with laughter.,donna-19,https://www.imdb.com/user/ur0203802/?ref_=tt_urv,9 December 2000,"0 out of 0 found this helpful. Was this review helpful? Sign in to vote.
Permalink",False,"I think this movie is the funniest I've seen since The Full Monty. Not only does it employ visual and obvious humor, but the subtle humor is almost too much to bear. I literally laughed until I cried. If you want a fun movie night out, this movie should be at the top of your list. You'll be surprised how many people are in it whose names you don't know but whose faces are very familiar. There are no prima-donnas in this film, it's not big budget, and there isn't much sex or violence. If that's what you crave, skip this movie. It's simply a cute story told in a highly professional manner by very good actors and actresses. The top notch writing and acting made this movie really deliver for me.
0 out of 0 found this helpful. Was this review helpful? Sign in to vote.
Permalink"
https://www.imdb.com/title/tt0218839/reviews?ref_=tt_ov_rt,8/10,very humorous satire,l_galescu,https://www.imdb.com/user/ur0937229/?ref_=tt_urv,5 December 2000,"0 out of 0 found this helpful. Was this review helpful? Sign in to vote.
Permalink",False,"This is a very funny, satirical look at today's American society. I could do without a couple of exaggerations, but otherwise, there is a lot of subtlety and wit, and a great deal of talent put into this film. The viewer has to be always alert because in many scenes some strong caricatural elements are in the details, rather than in what appears to be the main focus.

And, yes, it made me laugh almost all the time.
0 out of 0 found this helpful. Was this review helpful? Sign in to vote.
Permalink"
https://www.imdb.com/title/tt0218839/reviews?ref_=tt_ov_rt,7/10,Leave the theatre with a smile.,smakawhat,https://www.imdb.com/user/ur0464186/?ref_=tt_urv,4 December 2000,"0 out of 0 found this helpful. Was this review helpful? Sign in to vote.
Permalink",False,"This is a very funny and yet warm movie.

It is nothing serious, and it is one of those simple films that leave you feeling all warm inside and a big grin on your face. The characters are done so well, especially the neurotic repressed Wamierauner(sp?) owners.

The dialogue in this film is so superb and it seems like it was all adlibbed. That is what makes it so amazing, here is a sample (somewhat accurate but conveys the mood and brilliance of the writing).

""We met at Starbucks"" ""No not AT Starbucks exactly you see"" ""Oh yes that's right.."" ""See he was sitting AT a Starbucks across the street drinking Late"" ""Yeah and she was sitting at the OTHER Starbucks across the street, not the one I was in bUT THE other one over there drink umm, Capuccino.. ""No Mochachino,.. ""Oh yeah right...""

Classic. Or even better:

""We have many things in common. We both like soup.""

Great characters, funny, just pure enjoyable. The movie does kind of make fun of the whole 'business of dogs and their owners', but it is harmless. I think it is even harder for actors to pull something off like this in a mocumentary as opposed to a standard film cause the characters have to come across as REAL people not actors. What a great job they did.

Rating 7.5 out of 10."
https://www.imdb.com/title/tt0218839/reviews?ref_=tt_ov_rt,10/10,Absolute Best Show,aleeds,https://www.imdb.com/user/ur0912000/?ref_=tt_urv,28 November 2000,"0 out of 0 found this helpful. Was this review helpful? Sign in to vote.
Permalink",False,"A highest-quality comedy -- I couldn't recommend it more! At once hilarious and subtle. Has a documentary style -- you feel like you're peaking into the lives of real people, rather than watching characters on the screen. What a delight!

Looking forward to seeing it again sometime soon.
0 out of 0 found this helpful. Was this review helpful? Sign in to vote.
Permalink"
https://www.imdb.com/title/tt0218839/reviews?ref_=tt_ov_rt,9/10,"It's all about Relationships, not dogs!",thomasj-2,https://www.imdb.com/user/ur0941672/?ref_=tt_urv,20 November 2000,"0 out of 0 found this helpful. Was this review helpful? Sign in to vote.
Permalink",False,"While I found the movie about dogs very funny on a superficial level, it was really quite a commentary on relationships! From the interaction between the Flecks to the interplay of the two commentators at the Mayflower, it was obvious that source of the humor was really the interplay between people, not the quirkiness of dog owners. It was only more obvious because the humans tried to use the dogs as surrogate partners if they didn't get the response that they were looking to get!

I believe the movie was at least as funny as Spinal Tap, but more meaningful. Partly because I could more easily relate to the characters, but also because we all have an interest or two, that when viewed by others, is quirky and odd.

While I found the acting and writing to be quite fresh (how much can YOU bench press?), it did on a couple of occasions revert too easily to comedic stereotypes.
0 out of 0 found this helpful. Was this review helpful? Sign in to vote.
Permalink"
https://www.imdb.com/title/tt0218839/reviews?ref_=tt_ov_rt,8/10,"A funny, somewhat surreal comedy.",mrdaytonoh,https://www.imdb.com/user/ur0937867/?ref_=tt_urv,17 November 2000,"0 out of 0 found this helpful. Was this review helpful? Sign in to vote.
Permalink",False,"I viewed this film one evening with about four other folks in the theater, which is kind of too bad. Its straight-faced silliness perhaps did not bring on belly laughs, but it did have me grinning throughout. Which might be the higher compliment.
0 out of 0 found this helpful. Was this review helpful? Sign in to vote.
Permalink"
https://www.imdb.com/title/tt0218839/reviews?ref_=tt_ov_rt,9/10,If you like to laugh a lot....,flickhundt,https://www.imdb.com/user/ur0933243/?ref_=tt_urv,13 November 2000,"0 out of 0 found this helpful. Was this review helpful? Sign in to vote.
Permalink",False,"Best in Show had us laughing from start to finish. Immediately sent e-mails to all our friends to tell them to catch it before it leaves town.

The best part is that every character isn't just believable, I feel like I know them personally. If you really like to laugh a lot, don't miss it!
0 out of 0 found this helpful. Was this review helpful? Sign in to vote.
Permalink"
https://www.imdb.com/title/tt0218839/reviews?ref_=tt_ov_rt,,See it at a matinee,aquadri,https://www.imdb.com/user/ur0582949/?ref_=tt_urv,12 November 2000,"0 out of 0 found this helpful. Was this review helpful? Sign in to vote.
Permalink",False,"If you plan on going to see this movie, I recommend going to a matinee. It will be cheaper and you will be less disappointed if you're as ambivalent about this film as I am. Positives about this movie include spectacular casting and a heavy dose of humor. Michael Hitchcock and Parker Posey are the most believable couple in the entire film, and the joke they make about how they met was hilarious to me (but likely only because I used to work at a Starbucks that _was_ directly across the street from another). However, the believability of this movie as a whole was lacking. ""Dancer in the Dark,"" with all its moments that required you to suspend your disbelief, was more believable than ""Best in Show."" Also, while I understand that this is a mockumentary, I feel that like a real documentary, films in this genre should make you care about the people in it. This one didn't. This was a funny movie, but the bottom line for me is this: It's more intelligent than an Adam Sandler movie, but just as pointless.
0 out of 0 found this helpful. Was this review helpful? Sign in to vote.
Permalink"
https://www.imdb.com/title/tt0218839/reviews?ref_=tt_ov_rt,10/10,SEE THIS MOVIE!!,act1966,https://www.imdb.com/user/ur0552665/?ref_=tt_urv,4 October 2000,"0 out of 0 found this helpful. Was this review helpful? Sign in to vote.
Permalink",False,"I haven't laughed this hard in a movie since ""Showgirls"". Brilliant, subtle performances (even Eugene Levy!) and a keen insight into the demented world of dog shows and obsessive dog owners.

Why isn't this movie in wider release? The question hit me when I walked out of the Paramount in Toronto. Especially when refuse like ""Urban Legand: The Final C**p"" dominates movie theatres.

Support this brilliant and hysterical movie!
0 out of 0 found this helpful. Was this review helpful? Sign in to vote.
Permalink"
https://www.imdb.com/title/tt0218839/reviews?ref_=tt_ov_rt,7/10,Clever and funny,mmunies,https://www.imdb.com/user/ur0620705/?ref_=tt_urv,4 November 2000,"0 out of 0 found this helpful. Was this review helpful? Sign in to vote.
Permalink",False,"I liked this movie - I also didn't think it was outright hilarious but it had some real genuinely funny moments and kept me giggling throughout it.

I couldn't believe those owners! YARG! Several of those people would have sent me screaming! They were simply awful but I could honestly believe that there are people like this in all walks of life.

The dialogue was really wonderful - particularly in scenes with the announcer. I really loved the characterization of the owners (each in their own unique, awful, batty way) and of course, the dogs. The dogs were brilliant and the only sane ones in the movie.

For both dog lovers and non-dog lovers!
0 out of 0 found this helpful. Was this review helpful? Sign in to vote.
Permalink"
