https://www.imdb.com/title/tt1633356/reviews?ref_=tt_ov_rt,10/10,Way Better Then Piranha 3D ! that Movie Was Horrible !,HPForeverDarkLord,https://www.imdb.com/user/ur28810149/?ref_=tt_urv,29 February 2012,"2 out of 8 found this helpful. Was this review helpful? Sign in to vote.
Permalink",True,"first of all i want see this movie Because i love Scary Movies think Sara Paxton she great actor plus thing i really like this was 3D stunning effects petty good i also like that this video was over done with sex and Nudity Scenes Like Piranha 3D if ask me was horrible movie but if looking for good scary intense movie with some Funny scenes i say go see this movie or rent as it is now on DVD over think actors did petty good job i also really enjoy the The final Destination 3D Movie i say this movie is Good For ages 13 and up think young kids would fine with see this movie there some gory scenes but is not over done as much piranha 3D was think worst scene for kids could be girl is in boat with other guys and she in her bra and panties then is feed to baby Sharks also ending i find Petty Funny so i say Go Rent this Movie is Great Funny Movie or Intesne movie Also recommend Check Dream House !
2 out of 8 found this helpful. Was this review helpful? Sign in to vote.
Permalink"
https://www.imdb.com/title/tt1633356/reviews?ref_=tt_ov_rt,1/10,Worse than I ever imagined!,jk90us,https://www.imdb.com/user/ur2245466/?ref_=tt_urv,8 January 2012,"1 out of 3 found this helpful. Was this review helpful? Sign in to vote.
Permalink",True,"I (and thousands of moviegoers and critics with any common sense) ranted about this limp piece of uncreative fluff when they first announced it would be a worthless PG-13. I also refused to see it. Well, unfortunately, I did have to see it on DVD last night when some friends rented it and popped it into their player. And it was even WORSE than I EVER imagined.

It was like the writers and director stole the Slasher Flick 101 Handbook (which, BTW, stopped being interesting in the freaking '80s) and followed it word for freaking word: 1. Group of diverse college kids (made up of the standard cute innocent girl, a slightly-dorky guy we know she will fall for, a horn-dog dork goof ball comedienne, a dimwitted jock, a black guy and two sluts), drive into the deep woods for the weekend to drink and bang each other.

2. They run into the redneck creepy perverted locals and the small town sheriff (who we all know is in league with the redneck creepy perverted locals the moment he shows up) on the way.

3. They get to the house where the drinking and killing quickly begin while doing incredibly stupid things that hasten their demise.

4. But instead of having redneck, backwoods slasher psychotic freaks, they used sharks instead....which were put IN the lake by redneck, backwoods slasher psychotic freaks.

YAWN.

And this was all played out in every predictable way possible (including the revelation of who put the sharks in the water, the shark jumping out of the water to get the guy on the jet ski, and the idiotic last shot of a shark jumping out of the water in the end). All of us in the room watching the DVD called out each and every scene before it happened because we'd all seen it a countless times before in a hundred different movies.

But the absolute biggest problem (as every pone knows) with this bird dropping of a flick was the rating. While the slasher films this turd ripped off are rightly rated R and contain hardcore blood, guts and hot naked women to help offset their pathetic attempt at a screenplay and acting, this PG-13 rated excuse for a movie has none of that.

It's all G-rated screaming, churning water and blood rising up while the attacks happen below the water out of sight! Did you read that? Outofsight!! People don't pay their hard earned money to NOT see things on the (bleeping) screen! As for nudity, all we got were teaser shots of girls in bikinis the entire time, something we can see in every lame magazine and TV show these days. Oh, but they did show the bare butt of the freaking jock! Who the hell did the director think would want to see that? Did he think his audience was going to be filled with women and gay guys only? Then again, maybe it was since this stinker only made a few million in the theaters -- even with the extra $3 charge for 3D glasses.

The SyFy Channel (while still too GUTLESS to show nudity) will at least show hardcore blood and guts when people get attacked by the cartoon sharks and creatures in their films. BTW their cartoon sharks and creatures look even more realistic than the sharks in this supposedly big-budget film.

The hacks who wrote, produced and directed this thing should have at least made an R or unrated version to release on DVD with the blood, guts and boobs they left out (along with any entertainment value at all) in the theatrical version. But apparently -- based on what they did release -- they aren't that smart. They definitely have no idea what people want to see in a shark film (Hint: think ""Piranha"" and its upcoming sequel).

Do yourself a huge favor and avoid this mess. And if you just happened to read my post because you don't mind spoilers, don't worry. There are no spoilers here -- because you've seen it all before. In fact, you've seen so much more in other films than you will in this one.
1 out of 3 found this helpful. Was this review helpful? Sign in to vote.
Permalink"
https://www.imdb.com/title/tt1633356/reviews?ref_=tt_ov_rt,1/10,Total trash,abstain13,https://www.imdb.com/user/ur4338710/?ref_=tt_urv,13 September 2011,"1 out of 3 found this helpful. Was this review helpful? Sign in to vote.
Permalink",False,"I am a horror fan, a genre fan and do enjoy ""B"" movies, but this was beyond awful. The story was so bad that it was beyond amusing and became frustrating. So full of stupidity and plot holes... agh what a steaming pile! The ONLY good actor/actress in the whole thing was the DOG! It's not uncommon for these Hollywood genre attempts to be painfully dumbed down, contain terrible ""talent"" with nothing more going for them then sex appeal but this epidemic is spreading!

Furthermore, the CGI was completely amateur and really made a crap film look worse. There honestly wasn't a single redeeming feature throughout this waste of time.

Avoid this pile of shark poop at all costs.
1 out of 3 found this helpful. Was this review helpful? Sign in to vote.
Permalink"
https://www.imdb.com/title/tt1633356/reviews?ref_=tt_ov_rt,2/10,It would have been good for an original Sci-Fi channel film...,upstreamtuna,https://www.imdb.com/user/ur22295199/?ref_=tt_urv,5 September 2011,"1 out of 3 found this helpful. Was this review helpful? Sign in to vote.
Permalink",True,"I saw this one at the drive-in, but thankfully it was backed up by ""Fright Night"".

The premise is very simple: Sharks in a lake start eating the college kids who go into the lake.

There is somewhat of back-story involving the hillbillies that put the sharks in the lake and attached cameras to them to record the sharks eating people, which then they would sell to get money. Lots of money. It takes itself WAY too seriously.

The villainous hicks in the film are relatively more scary than the actual sharks in the film.

I completely lost interest in the film when they killed off the most interesting character (Joel David Moore; of ""Avatar"", ""Hatchet"", and ""Grandma's Boy"" fame.)

I can't say much about this one. If you want to watch something of this quality, watch the Sci-Fi channel on a Saturday night. This DID NOT need to make it to the big screen.

2/5
1 out of 3 found this helpful. Was this review helpful? Sign in to vote.
Permalink"
https://www.imdb.com/title/tt1633356/reviews?ref_=tt_ov_rt,10/10,not great but not terrible either.,LinkGoku,https://www.imdb.com/user/ur21320033/?ref_=tt_urv,9 February 2012,"1 out of 7 found this helpful. Was this review helpful? Sign in to vote.
Permalink",False,"Let Me start off by saying that I don't think this movie deserves 10/10 *s, I'd probably just give it 6/10, but at the moment it's at 3.9/10 so I'm voting 10/10 to try and get the rating higher.

If Your looking for a serious and unpredictable horror film, then this isn't it. But Shark Night is fun and honestly I was surprised by a couple parts. I can't bring myself to call this a horror movie, more of an action flick.

On the downside, You never really care about any of the characters, and the movie is fairly clichéd.

On the upside, the effects are good, and story is surprisingly good too.

I would recommend Alexander Aja's Piranha over this. But Shark Night is still pretty entertaining."
https://www.imdb.com/title/tt1633356/reviews?ref_=tt_ov_rt,8/10,Best Shark Movie since Jaws - Realistic Shark EFX,mojoguzzi-879-68498,https://www.imdb.com/user/ur49076653/?ref_=tt_urv,30 July 2016,"0 out of 1 found this helpful. Was this review helpful? Sign in to vote.
Permalink",False,"I absolutely hate the typical Syfy sharkcrapolis movies with their garbage CG efx that make it impossible to suspend disbelief and lose yourself in the story, so I was pleasantly surprised when I DVR'ed this one and checked it out. It was produced by a different company than the cynical one that cranks out the usual Syfy grade D cable fodder and the director, with a solid background directing efx-laden features and second unit on big budget movies, took pains to ensure the sharks looked as close to realistic as modest budget CG allows. They actually look better than some CG in recent big budget movies.

An attractive cast heads up the story, which is not nearly as far-fetched as most films in this sub-genre. It's played straight, no corny humor, and the actors are very believable. There's plenty of genuine suspense and real horror movie thrills.

The photography is excellent, the location is sometimes stunningly beautiful. Overall the production values are topnotch.
0 out of 1 found this helpful. Was this review helpful? Sign in to vote.
Permalink"
https://www.imdb.com/title/tt1633356/reviews?ref_=tt_ov_rt,6/10,not bad for a Sunday night,mark-field-85,https://www.imdb.com/user/ur42664462/?ref_=tt_urv,14 April 2013,"0 out of 1 found this helpful. Was this review helpful? Sign in to vote.
Permalink",False,"If you looking for something serious, scary and well acted then look somewhere else. if you just want a fun chill out movie to unwind and get a bit of a laugh shark night might be for you. its not great its no Jaws nor does it ever try to be. its just a B grade good time that is pretty predictable and does nothing that hasn't been done before and will be forgotten faster than the length of the movie but its still a good movie for a time waster. if you enjoyed Bait or Snakes on a plane etc. Then this one wont disappoint. its hard to write 10 lines about this movie because even though its good there is nothing really rememberable about it and the plot twists a blind man can see coming
0 out of 1 found this helpful. Was this review helpful? Sign in to vote.
Permalink"
https://www.imdb.com/title/tt1633356/reviews?ref_=tt_ov_rt,1/10,Just Simply Forget This One,plutus1947,https://www.imdb.com/user/ur3512256/?ref_=tt_urv,30 March 2013,"0 out of 1 found this helpful. Was this review helpful? Sign in to vote.
Permalink",False,"This Review does not contain 'Spoilers' because this movie is Spoiler enough.

My review: A totally and utterly ridiculous movie.

Such a shame because there were a couple of normally excellent actors in it, especially Katherine McPhee (Smash).

The movie is an abysmal attempt at a take-off of of other movies, notably the 'Jaws' series

The direction was a total joke and the storyline one of the worse I have ever encountered Do yourselves a favour and avoid this movie like the plague
0 out of 1 found this helpful. Was this review helpful? Sign in to vote.
Permalink"
https://www.imdb.com/title/tt1633356/reviews?ref_=tt_ov_rt,7/10,If You Want a Shark Movie Try Jaws or Jaws 2,Stanjaudit,https://www.imdb.com/user/ur28640599/?ref_=tt_urv,9 January 2013,"0 out of 1 found this helpful. Was this review helpful? Sign in to vote.
Permalink",False,"I'm amazed at the complete ignorance of some people that want to tear Shsrk Night 3D apart. The opening credits clearly state there is a director for anamatronics. So what's the big deal over fake sharks. If you subscribe to Netflix and stream it you get more info and one thing it clearly points out that the lake is crystal clear but all underwater shots were shot with a green filter to give it a murky look. As far as the script and the direction it was adequate. The editing was excellent. You knew what was happening at each situation whether on the wave rider, on the Dennis Crims boat, with Nick and the Sheriff or Sara and Dennis. So before you get to critical become aware of your facts.
0 out of 1 found this helpful. Was this review helpful? Sign in to vote.
Permalink"
https://www.imdb.com/title/tt1633356/reviews?ref_=tt_ov_rt,3/10,Amazingly bad,MattyGibbs,https://www.imdb.com/user/ur24012560/?ref_=tt_urv,31 August 2012,"0 out of 1 found this helpful. Was this review helpful? Sign in to vote.
Permalink",False,"I have seen my fair share of low budget and no budget films in my time but this 'effort' left me literally open mouthed. You don't expect great acting or decent effects but literally this film has absolutely no redeeming features at all. I expected something along the lines of Piranha which was stupid but surprisingly entertaining, what I got was nothing.

No tension, suspense, acting ability plot or even the remotest semblance of realism.

Noting that this is from the director of by far the worst entries in the ' Final Destination' series, this is no surprise. However even those relatively poor efforts are Oscar winners compared to this steaming pile of excrement. I am loathe to give any film 1/10 but this tripe is more than worth it.

AVOID.
0 out of 1 found this helpful. Was this review helpful? Sign in to vote.
Permalink"
https://www.imdb.com/title/tt1633356/reviews?ref_=tt_ov_rt,6/10,Sharks At Camp Blood?,ksj870,https://www.imdb.com/user/ur16424670/?ref_=tt_urv,28 June 2012,"0 out of 1 found this helpful. Was this review helpful? Sign in to vote.
Permalink",False,"Friday the 13th with sharks.

That pretty much sums up the plot for Shark Night 3D. It's the tried-and-true formula of putting a group of young adults in an isolated wilderness environment and then slaughtering them one by one, either by a maniac in a hockey mask or, in this particular case, big fish with teeth and a ravenous appetite. If you understand that's what you're in for going in to things, then Shark Night 3D won't disappoint.

The mayhem is all quite competently staged. Director David R. Ellis knows what looks good on camera and even in that most dubious of cinematic blessings, 3D. Ellis has some unique visual tricks up his sleeve and the movie is colorfully and atmospherically shot. The shark attacks that are at the core of the story are well-done, although some horror fans may be let down by the relative lack of gore—this is, after all, a PG-13 film, and the carnage therefore a bit restrained. Still, the numerous shark attacks usually pack a surprising punch and the proceedings are certainly not devoid of blood, if that's your thing. Moreover, the 3D effects are put to pretty good use, and in a number of scenes garishly fanged shark snouts seem to swim right out of the screen at you. Nice.

The cast seems to be having a good time and everybody does a professional job. Of course, the script doesn't tell us much about most of the characters, who exist primarily to be eaten by the voracious sharks, but at least none of them are totally unlikeable The story's protagonists are Sara (played by the very hot Sarah Paxton) and her potential boyfriend, Nick (Dustin Milligan), and we do get to learn a little more about them. Sara is troubled by something that happened four years ago, something that has perhaps come back to haunt her once more, and Nick is a shy, rather nerdy medical student with a seemingly hopeless crush on Sara. Both actors are charismatic and create characters it's easy to identify with.

Shark Night 3D isn't food for deep thought, but if you like b-movies and can appreciate their unique charms, then this is a very fun movie. It doesn't compare well to Jaws or even the more recent thriller The Reef, but then it's really not built to compete with those films. This movie's role model is something more along the lines of, you guessed it, Friday the 13th. And for what it's worth, I think Jason Voorhees would be proud."
https://www.imdb.com/title/tt1633356/reviews?ref_=tt_ov_rt,6/10,It wasn't that bad as the reviews say,armando_z2005,https://www.imdb.com/user/ur7238696/?ref_=tt_urv,15 June 2012,"0 out of 2 found this helpful. Was this review helpful? Sign in to vote.
Permalink",False,"I read some reviews on here before checking it out on Netflix and based on the low rating and on the reviews the movie isn't at all garbage. If it's somewhat decent to the rest of the shark night movies mixed with some of today's cast. Although some actors I have never seen before but the whole movie isn't bad.

The start was alright nothing to big and exciting and the acting throughout the whole movie was alright typical for your teen/college characters. There wasn't allot of scare scenes and most of the movie was not at all overly clingy. I kinda liked how the whole thing played out, defiantly a twist I did not see coming from some characters in the movie.

This is a pretty good for a Saturday night or Friday night when you're home alone and bored and want something that is light and not gory like Piranha was because there wasn't allot of blood.

I give this movie a 6/10."
https://www.imdb.com/title/tt1633356/reviews?ref_=tt_ov_rt,6/10,Shark Night 3D (2011),SnakesOnAnAfricanPlain,https://www.imdb.com/user/ur4834714/?ref_=tt_urv,10 June 2012,"0 out of 1 found this helpful. Was this review helpful? Sign in to vote.
Permalink",False,"Shark Night's only real sin is that it plays to a PG-13 audience. That's OK for a film like Jaws which has powerful performances and wonderful characters. Not to mention incredible suspense. But if you're going to make a cheap and nasty killer animal film, make it nasty. Still, there are lots of things to enjoy here for lovers of such a crappy genre. A group of teens suffering from a disease that makes them look like they are in their mid-twenties, go on an island vacation. No phones, no internet, no contact with the outside world. Bliss. Unluckily for them, but luckily for the audience, there are some sharks to tear these guys apart. Same as ever, but with some particularly bad CGI, it includes some unique scenes that get you excited. Best of all is a one armed man going to fight a hammerhead with nothing but a spear and his fists. It was also fun to see Joshua Leonard as a real creepy hick. Daft dialogue, annoying characters, but a bit of fun. Don't take it too seriously.
0 out of 1 found this helpful. Was this review helpful? Sign in to vote.
Permalink"
https://www.imdb.com/title/tt1633356/reviews?ref_=tt_ov_rt,6/10,ha ha,boldentommy,https://www.imdb.com/user/ur32758209/?ref_=tt_urv,15 May 2012,"0 out of 1 found this helpful. Was this review helpful? Sign in to vote.
Permalink",False,"I don't understand why everyone is giving this movie a hard time. This movie is not meant to be a horror classic its meant to be a joke, mindless entertainment and it was good at that. I didn't care about the back story for the characters. I knew who they were as soon as they got on to the screen. People need to realize what they are getting when they watch this movie and stop comparing every shark movie to jaws. So what a bunch of rednecks put some sharks into a lake and started feeding random people to them that to me is better then watching the same random jaws rip off it was funny and fun i had a great time.My favorite scene is when the black guy killed the hammer head with a spear. Also when the guy on the wave runner to get ripped off by the great white. All and all a campy movie one that i will watch one more time with some friend. I say give it a try don't take it so serious sit back and enjoy the ride.
0 out of 1 found this helpful. Was this review helpful? Sign in to vote.
Permalink"
https://www.imdb.com/title/tt1633356/reviews?ref_=tt_ov_rt,6/10,Not bad for a shark attack thriller,phd_travel,https://www.imdb.com/user/ur22484170/?ref_=tt_urv,28 March 2012,"0 out of 1 found this helpful. Was this review helpful? Sign in to vote.
Permalink",True,"For those who would enjoy an updated Jaws type thriller this will be right for them. Don't expect too much and it will be fun. It isn't too gory so it's okay to watch as a thriller. The cast is likable and attractive with Sarah Paxton as the lead and even Katherine McPhee - thank goodness she got Smash to utilise her talents instead of doing this type of movie. The supporting cast is okay with Dustin Milligan and Chris Zylka. It's quite nicely photographed. You know what to expect - the usual devourings.

Weak points: The rather exaggerated revenge plot by the bad guys and how isolated they are.

Overall it's quite good fun for this type of movie.
0 out of 1 found this helpful. Was this review helpful? Sign in to vote.
Permalink"
https://www.imdb.com/title/tt1633356/reviews?ref_=tt_ov_rt,6/10,Not a terrible film but could have been better.,jhpstrydom,https://www.imdb.com/user/ur16399785/?ref_=tt_urv,27 March 2012,"0 out of 1 found this helpful. Was this review helpful? Sign in to vote.
Permalink",False,"Its about time they brought out a killer shark attack movie that wasn't just another low budget direct to video or made for TV cheese fest but one that came out in theaters, even though SHARK NIGHT was in fact released in theaters it is unfortunately not the kind of shark movie I had hoped to see in theaters, mainly because its too tame and doesn't have a whole lot of suspense, keeping in mind this film is PG13 it was almost as if the producers were trying to cater to a certain type of audience with the wrong type of film.

For instance the central characters are a bunch of college graduates in their early to mid 20's so obviously this film was aimed at teenagers instead of fans of killer shark films, in one way its not a bad thing in the other many people are not going to want to see a kids movie they would want to see a suspense packed, fast pace and very intense shark movie and like I said SHARK NIGHT is not that movie.

Overall, SHARK NIGHT isn't a terrible movie but its more of shark movie for kids, all that we need now is a shark movie for adults."
https://www.imdb.com/title/tt1633356/reviews?ref_=tt_ov_rt,5/10,Scream meets Jaws...that's different! Shark Night a review:,MovieCritic33-6,https://www.imdb.com/user/ur23157722/?ref_=tt_urv,13 February 2012,"0 out of 1 found this helpful. Was this review helpful? Sign in to vote.
Permalink",True,"Actors: Sara Paxton, Alyssa Diaz, Dustin Milligan, Katharine McPhee, and Joel David Moore.

Plot: A group of college kids head on up to their friend Sarah's lake house, on a secluded Louisiana lake. But much to their demise what they do not know is that this salt water lake is infested with various species of sharks. The question is how did they get into this lake and why? ACTING: Not much to say, it's a horror movie. Beside let's face it they are only as good as the script permits.

TONE: Serious and dark horror movie, with a huge lack of thrills and suspense.

SCRIPT: A ""B"" movie script. I will say the concept is MOSTLY original. Cheesy all around, dry humour (wait was their any?). Scream meets Jaws (that's a first!).

PROS: Entertaining (for viewers with a respect for ""B"" movies). Cool variety of sharks.

CONS: Rather ludicrous (no matter which way you flip the coin). Dissatisfying shark attacks and not nearly enough carnage for this genre. You hardly see the sharks.

VERDICT: Whatever you do DO NOT BUY this movie BEFORE PREVIEWING it because I guarantee, you will be disappointed. I am one of those who bought this film before previewing, and I knew the risks. I don't regret this purchase because under the RIGHT circumstances this film is extremely mindless and fun to watch in all of it's awfulness (sometimes you just have to love it for what it is). I will say that I do love the irony the film conveys, the antagonists are filming the shark attacks (sound like another scary movie that just came out not too long before? --> ""Scream 4"") and one of the character's say that people would pay to see some sharks eating people (isn't that what WE paid to see?). The problem with Shark Night is that it takes itself seriously, and with it's plot how can you? I believe that is the only thing that actually makes this film humorous. But honestly if you have no respect for ""B"" movies just avoid this one. If you are looking for something just as brainless but done right, go out and rent or buy Piranha (the 1978 original or the 2010 remake) they're both campy fun! But if you're looking for a fun shark movie, I always liked Deep Blue Sea, than of course their is Jaws and its campy successors.
0 out of 1 found this helpful. Was this review helpful? Sign in to vote.
Permalink"
