https://www.imdb.com/title/tt1633356/reviews?ref_=tt_ov_rt,6/10,"Shark Night 3D, average horror movie with sharks and rednecks",DesertDogMedia,https://www.imdb.com/user/ur46757591/?ref_=tt_urv,2 July 2014,"0 out of 0 found this helpful. Was this review helpful? Sign in to vote.
Permalink",True,"Title: Shark Night 3D

Directed by: David R. Ellis

Storyline: We then cut to a high school or college or university or what ever it is, where it seems to be results day. We also get a product placement of the Halo franchise here as well. We see a confrontation scene which turns out to be a comical ploy to make the plot develop. Once they get the boat and have been driving for a while. We also get an unwinding montage of them just dancing or comparing clothes, not sure if this is what normal people would do, but I'll let it pass for being a nice montage, it also reminds us of the other side of the 15 rating by showing 'side boob'. Nick then takes Malik boat surfing, and they get out into the deeper swamp and this is when we see a fin protruding from the water and Malik gets knocked off his board by the shark. Once Nick finds the arm and escapes the shark, they then make their way to the nearest hospital on the boat but the blood dripping from his arm is leaking into the water and leaving a trail for the sharks to follow. But the sharks hit the boat and knocks Maya out of the boat and into the water where she gets eaten. A shark also takes out the boat's steering some how and this causes them to crash and blow up the boat. Which is honestly a good explosion and looks realistic and not CGI. That is how explosions should look. This is when the rednecks show up, Gordon and Beth go with the rednecks to go and get help but it turns out the rednecks were just leading them into a trap. Back at the house Malik takes a spear and tries to find the shark that took his arm, surprisingly he finds the correct one and kills it. Back on the redneck boat they push Gordon into the watch but he is able to climb a tree to only get eaten. Back at the house they find a camera on the shark Malik killed and they work out that people have released sharks into the water to kill people. Blake takes Malik on the jetski to try and get him to a hospital before he dies but they both end up dying. The rednecks kill Beth by feeding her to Cookie Cutter sharks, this is one thing I have to give them props for, because they took a very uncommon barely known shark and gave it screen time, the CGI for the Cookie Cutters is some of the best in the movie as they are the most correctly portrayed visuals of Cookie Cutters. We also find out that the police sheriff Sabin, is also working with the rednecks, it isn't an unexpected plot twist but it is nicely played. Sabin is back at the house with Nick while Sara and the rednecks are on the boat planning to feed Sara to the sharks before she drowns in the cage. You see Nick spill gasoline while Sabin is dunking him in the water, but some how Nick is able to get a lighter out of no where while he's tied to a chair and throw it at the gasoline trail, setting Sabin on fire so he falls into the shark water. But you see the wig of the stunt double fall off when he falls into the water. But we all know how this ends, good guy Nick survives and saves the girl and the redneck gets what he deserves.

Acting: The first scene in the student dorm is good with Malik played by Sinqua Walls pretending to be serious, but this is ruined by Nick played by Dustin Milligan reacting too quickly to Malik's joke. But for everyone else during the movie, they are all believable and decent actors who can portray emotion when they need to and look believable when they need to.

Noticeable Camera work: At the start we see underwater shots, but you'll also see that the cameraman is constantly moving the camera. As an underwater videographer that really annoying me as they could have a great shot if only they knew how to hold a camera steady in the water. Our first piece of fun camera work is a speeded up montage like trip to Sara's beach house which takes them a day to get to by car. There is also an across the water shot which appeared to have been done by the camera crew on a boat or barge. Good POV shot from the police boat as they start off the boat chase followed by birds eye shots from before and during the chase.

Graphics: We finally see the shark a third into the movie and the CGI for the shark isn't the best there is. The shark looks like it is actually in the water, so they have got that part correctly, but the shark itself looks fake, but credit where it is due as they were able to make the background of it look real to immerse it into the water.

Overall Feel: This is a B-rated movie, this means that it isn't as good as your other general cinema released movie. But you can watch this movie and enjoy it as you can tell that the people who made the movie, put their all in making this movie. They also did good for a budget of $25,000,000 as they were able to get good sets, good actors and decent CGI. So if you enjoy movies where good guy beats bad guy but with added sharks, then you'll enjoy this film. I feel it is underrated because of its 4 stars, it should at least have 6 in my opinion.
0 out of 0 found this helpful. Was this review helpful? Sign in to vote.
Permalink"
https://www.imdb.com/title/tt1633356/reviews?ref_=tt_ov_rt,7/10,Well... what are you expecting?,bowmanblue,https://www.imdb.com/user/ur1406466/?ref_=tt_urv,14 May 2014,"0 out of 0 found this helpful. Was this review helpful? Sign in to vote.
Permalink",False,"After watching Shark Night, I was totally disgusted - NO character development, NO story, NO deep and meaningful inner message designed to enrich the soul and really make you think.

Only kidding.

If you haven't already figured it out, Shark Night is about sharks - sharks that eat people. And, if that's all you're looking for, you shouldn't feel too short-changed.

Shark Night starts off with a couple of carefree, randy American teenagers, frolicking around in a salt water lake - guess what happens to them? Anyway, cut to the local collage where a group of seven insanely good-looking teens, all armed with quick wits and iphones, go to the same salt water lake to chill out.

Then, when bikini meets shark teeth, there can only be one winner. Okay, so the sharks are all (surprise surprise) water-based, but don't worry, our human heroes find every excuse possible to end up in the water.

So, there you have it. If you like your B-movies bloodthirsty and don't take things too seriously, you'll enjoy this (think Piranha 3D or Cabin Fever). Some other reviews have said the special effects looked cheap and there wasn't enough of the sharks. I found the FX okay and the sharks were hardly given any real dialogue to learn, so give them a break, okay?

http://thewrongtreemoviereviews.blogspot.co.uk/"
https://www.imdb.com/title/tt1633356/reviews?ref_=tt_ov_rt,3/10,Shark Night is more like Schlock Night. It's take a big bite out of stupidity.,ironhorse_iv,https://www.imdb.com/user/ur34049683/?ref_=tt_urv,16 August 2013,"0 out of 0 found this helpful. Was this review helpful? Sign in to vote.
Permalink",True,"It seems that many folks have forgotten how to just enjoy a movie. This movie is supposed to be just here to be fun and not to be taken seriously. Sadly, I'm didn't enjoy it. This movie directed by late fame stunt man, David R. Ellis is just awful. Shark Night or advertised as Shark Night 3D is was his final film before his death. The film follows a group of blend college friends who has the most unrealistic beach bodies ever for college students. Most of the men have killer abs, while the girls go with tight bikinis even if they didn't have to. How on earth, did they get all that time to work out, with all that studying? Since, the movie is PG-13 and can't show nudity. All of the students go around the movie, half naked with their bathing suits even if they are not swimming. The group made out of Sara (Sara Paxton), Nick (Dustin Milligan), Maya (Alyssa Diaz), Blake (Chris Zylka), Gordon (Joel David Moore), Beth (Katherine McPhee) and Malik (Sinqua Walls) are at Sara's holiday home at a lake to party because one of them got a B plus on a grade. Can, we have one horror movie with college students not partying and really looks like smart people? These 'supposedly' college students are some of the crudest, over-sexed, idiots around. Soon they encounter Sara's ex Dennis (Chris Carmack) and his friends who acts like total dumb rednecks by being racist to the token black guy, Malik. Some people might be offended by how Malik is portray in this film. Some people might be offended with the portrayal of the rednecks as a negative stereotype. With names like Red (Joshua Leonard), it's clear that they're supposed to be country bumpkins. Anyways, the students soon find out that the town people are attracting sharks to the lake so they can sell the footage of the shark attacks for money. It's pretty senseless when you think about it. It cost more to produce the video, then to sale it. When I see nature documentaries, they took months to put together a specialist crew and high tech boat just to put a camera on an animal like that. The three rednecks alone put cameras in all those sharks, move them to a lake and made a lot of college kids disappear, just for a few dollars. I call BS with that. If people wanted to see it so badly, it's on the internet for free; why would somebody pay that much to see sharks attacking people? It doesn't make any sense. Talking about watching a Shark attack film. Why did some people did go to the theater to see this film? The story is pretty childish, predictable and campy. This movie is no 'Jaws'. (1975) It doesn't have any depth to the characters, and things about the plot doesn't add up. It's pretty laughable over the top, to see a man with one arm walk around seeking revenge for the shark for taking his arm, a few hours earlier! In real life, that man would be dead, due to the blood lose, or badly alive. Plus, how on earth is there no cell phone connection on this island or land-line connection? How cliché in a horror movie. The 3D is pretty annoying as it's too poking. The sharks had very poor CGI effects. The jumping thing isn't impossible, I understand watching nature videos, but it is something rare a shark would do. Plus, a shark wouldn't dare leap to take someone off a jet ski. Awesome shot, but impossible for a shark to do. I just wish they made it more real as a person who has loved sharks since he could walk, this movie makes all sharks seem like man-eating killers. In my opinion it's sad that films about killer sharks can't tell the different between near-harmless sharks to vicious meat eaters. Sand Tiger Sharks are not really that aggressive, genius. Plus, they have no clue what to do with a Cookie Cutter Shark. There are 350 different species of shark and only 6 of them eat people. And those 6 species usually don't attack people in the open water, unless they mistake a person for something they are not. Jaws makes sense because the shark could have mistaken the people as seals with the shots. In here, a shark will never go after a moving jet ski due to the noise and speed. This movie did not have good acting in it. Why was American Idol contestant Katharine McPhee even in this film? Hard to talk her serious as a singer, when she show her side boob in a cheesy shark attack movie. A lot of critics complain that there is no nudity. In my opinion, it doesn't need any nudity. Women shouldn't have to be on full display for stupid audience's amusement. It's a shark movie, not the playboy channel. The movie could stop with all the sexual overtones camera shots like side boobs, as zooming on some girl's butt. Sex sales, but it didn't work here. The editing is bad. Blown up scene of a boat exploding on a dock, is follow by jet-ski on the dock. Sorry, the jet-ski and the dock was blown up in the previous scene. That music video after the credits was annoying. The movie loaded from beginning to end with grating pop/R&B songs. Some of them work, some didn't. This movie obviously wasn't made to be taken seriously. It was made to showcase the lousy 3-D effects, bikini clad women, stupid PG-13 gore, and hunk men. In my opinion, it's market for dumbest of the pre-teens audience. Still, it's watchable if you like B-horror films. It should have been sent to DVD then the theaters. Maybe you won't want to own it, but if check out. Watch it with your own risk.
0 out of 0 found this helpful. Was this review helpful? Sign in to vote.
Permalink"
https://www.imdb.com/title/tt1633356/reviews?ref_=tt_ov_rt,2/10,Deep Blue Something,thesar-2,https://www.imdb.com/user/ur17825945/?ref_=tt_urv,1 December 2012,"0 out of 0 found this helpful. Was this review helpful? Sign in to vote.
Permalink",True,"One would almost forgive 'Shark Night 3D' for just being a Bmovie w/ a budget creature featureand it would've been just that pending they didn't add what they thought to be a ""smart plot"" half-way through. And I'm a sucker for Bmovie creature features, i.e. 'Piranha 3D,' but this one attempted to one-up and instead sunk depths. It's laugh-out-loud devilish plan to get skinny college idiots on holiday back into the waters once it's discovered a lake contains multiples of sharks is just plain stupid. At least, 'Piranha 3D' took the victims by surprise and that made it at least remotely realistic. Mercifully, it's incredibly short, but still should be avoided by all. 1½/5 Stars.
0 out of 0 found this helpful. Was this review helpful? Sign in to vote.
Permalink"
https://www.imdb.com/title/tt1633356/reviews?ref_=tt_ov_rt,3/10,A cliché horror flick,w_powell69,https://www.imdb.com/user/ur34921002/?ref_=tt_urv,1 December 2012,"0 out of 0 found this helpful. Was this review helpful? Sign in to vote.
Permalink",True,"This movie is basically a Jaws and Friday the 13th mash-up. The actors were amateurs, the plot was stale, and it had terrible CGI effects (seriously, the sharks look totally fake). My dog could create a better film than this trash. Speaking of dogs, the only scene that genuinely scared me (or surprised me would be a better term) was when one of the bad guys threw the dog off the boat; that's why I gave this movie a 3/10. The ending was so predictable; I knew the shark was going to jump out of the water. Unlike most of todays cliché horror films, this movie didn't have much nudity in it (that doesn't mean there isn't any nudity at all, though).

Anyways, you can watch the movie yourself and see what you think. I'm just one person with my own opinion. I think this movie is trash, but if you can stomach trash, then you can handle this film.
0 out of 0 found this helpful. Was this review helpful? Sign in to vote.
Permalink"
https://www.imdb.com/title/tt1633356/reviews?ref_=tt_ov_rt,6/10,"A Good, Fun PG-13 Horror Flick",Shazam-O,https://www.imdb.com/user/ur6219568/?ref_=tt_urv,30 November 2012,"0 out of 0 found this helpful. Was this review helpful? Sign in to vote.
Permalink",False,"For a PG-13 horror movie that is not overly gory, or full of nudity and profanity, Shark Night delivers better than expected. I don't have kids so I'm not generally concerned with it, but I gather that ""PG-13 Horror"" is a very tough market - both to find a good movie, and even harder to make a good movie. However, I didn't even know this movie was PG-13 until I read some comments on it - AFTER I'd seen it. And both my girlfriend and I enjoyed it WHILE we were watching it.

As with most movies in this category, the story is predictable, with foreseeable but fun twists along the way. The CGI is also not what I'd expect from a $25 million dollar price tag, but it doesn't detract from the movie too much if your goal is just to enjoy the ride.

You don't watch Shark Night 3D expecting to see Jaws, just like you don't watch Final Destination 2 (one of the director's earlier films) expecting to see The Shining. It's called ""Shark Night 3D"". If you want brilliant, highbrow suspense, go see something else. If you want ""Shark Night 3D"", watch this."
https://www.imdb.com/title/tt1633356/reviews?ref_=tt_ov_rt,2/10,Atrocious,Hojangs,https://www.imdb.com/user/ur35227803/?ref_=tt_urv,10 September 2012,"0 out of 0 found this helpful. Was this review helpful? Sign in to vote.
Permalink",False,"This film is absolutely terrible. There is not one redeeming feature. This is a film that isn't even 'so bad it's funny,' this is just plain awful. The writing is poor, the acting somehow worse, but the worst aspect of the film, and perhaps the most disappointing, were the effects. When seeing a film of this sort, you would expect the effects on the creatures to be at least passable. They weren't. They were literally PS2-era quality special effects. This was a total waste of about an hour and a half of my life. Perhaps had I seen the film in 3D I may have been able to add another point to my final score, but unfortunately I had to endure this in 2D. Endure being the preferred word. I endured this film.
0 out of 0 found this helpful. Was this review helpful? Sign in to vote.
Permalink"
https://www.imdb.com/title/tt1633356/reviews?ref_=tt_ov_rt,3/10,kind of dumb,soly_r_r,https://www.imdb.com/user/ur30636892/?ref_=tt_urv,3 August 2012,"0 out of 0 found this helpful. Was this review helpful? Sign in to vote.
Permalink",False,"now I'm in the middle of seeing this weak movie , It was such boring one that I prefer , let it go & come here to say don't watch this movie , all the shark scenes are unbelievable . the acting was so poor & you can't feel the horror or anything scary! Lot's of scary movies are being made like ""House of Wax"" , in those you don't know what will happen & that's kind of exciting but in this movie you are waiting for a shark to come therefore Director should excite you in other way but he couldn't , or at least he couldn't satisfy me by this . I suggest if you want to see a movie that's full of blood or fear , DON'T SEE THIS ONE !
0 out of 0 found this helpful. Was this review helpful? Sign in to vote.
Permalink"
https://www.imdb.com/title/tt1633356/reviews?ref_=tt_ov_rt,5/10,"Great If You Like Sharks and Horror, Brutal if Not",dimarinc,https://www.imdb.com/user/ur26700618/?ref_=tt_urv,4 April 2012,"0 out of 0 found this helpful. Was this review helpful? Sign in to vote.
Permalink",False,"Shark Night can be summed up without really watching the movie. The title says shark and the cover has it in killing position. The only real question of a theme movie like this would be: is it so good that it becomes a cult classic VS. is it so poor that not even shark fans should watch. The bottom line, it fits right in the middle.

There aren't too many good parts in this movie, but not many bad. It carries along and builds the setup and eventually gets thru its horror. The actress have a lot of visual appeal and the production value is top notch. The 3D in the title pushes that it is a polished movie. The acting is marginal, with a great cameo by Donal Logue.

The horror scenes aren't overly graphic and don't show too much. It wins as a horror by just having the shark fin cutting thru the water after the victims, but it loses from a shark standpoint because it really doesn't show much.

I would recommend this movie to fans of both horror movies and sharks."
https://www.imdb.com/title/tt1633356/reviews?ref_=tt_ov_rt,4/10,"It's one thing to make a movie thats so bad its good, but Shark Night is just bad.",Christian_Dimartino,https://www.imdb.com/user/ur22881716/?ref_=tt_urv,8 March 2012,"0 out of 0 found this helpful. Was this review helpful? Sign in to vote.
Permalink",True,"Okay, i'm sure it comes as not surprise for me to say that Shark Night is ridiculous. And you know what? I saw that coming. And sometimes a movie can be so bad it's good, such as 2010's Piranha. But to say that Shark Night is enjoyable is never going to happen.

Shark Night, like every movie about sharks that comes on SyFy, revolves around a group of college friends who go to a lake for spring break, only to e visited by, you know who, sharks. But not just sharks: Sharks that can jump out of water.

Shark Night may not have been one of those really bad Syfy movies that escaped their clutches, but it definitely is, proof or not. How could anyone let this ridiculous garbage go to theaters? Piranah worked. Why? Even though both films share some of the same traits, Piranha was intentionally hilarious, cringingly gross, while being funny, and a total blast. And the consistent nudity helped also.

Shark Night has no form of sex, no form of really over the top bloody blood, it's just empty. It's a really bad movie that just takes its ridiculousness to amazing levels. Shark Night is a joke, basically. And the joke is on them.

C-
0 out of 0 found this helpful. Was this review helpful? Sign in to vote.
Permalink"
https://www.imdb.com/title/tt1633356/reviews?ref_=tt_ov_rt,4/10,Shark Night 3D,jboothmillard,https://www.imdb.com/user/ur4248714/?ref_=tt_urv,22 February 2012,"0 out of 0 found this helpful. Was this review helpful? Sign in to vote.
Permalink",True,"I saw the trailer and clips for this film, and it was obviously another rerun or modern revamp of classic shark film Jaws, films like Deep Blue Sea and Open Water do alright trying this idea, and then came this one with 3D being the big draw, from director David R. Ellis (Final Destination 2, Cellular, Snakes on a Plane, The Final Destination). Basically seven college friends, Sara Palski (Aquamarine's Sara Paxton), Nick LaDuca (Dustin Milligan), Beth (Katharine McPhee), Malik (Sinqua Walls), Maya (Alyssa Diaz), Blake (Chris Zylka) and Gordon (Joel David Moore), are heading for a lake house for a weekend vacation with fun in the sun. Everything seems to be going smoothly, as they enjoy swimming in the pool and water skiing, but then all of the sudden Malik is taken into the water, and they are all shocked to see his arm has been bitten off. At first they are sure it is a freak accident with the power boat, but soon enough they spot in the lake shark swimming and hungry for flesh, so they must avoid the water. The nearest help they can get is a few hours away, so they get started travelling, but of course a shark is not too far behind them and claims a victim or two, there is more than one shark in the lake water. With no phone signal and their transport being damaged by the attacks there seems to be nowhere to go, but then Sara's old boyfriend Dennis Crim (Chris Carmack) and his friend Red (Joshua Leonard) show up on their boat, supposedly to help them. Of course they show their true intentions, they are the ones that released the shark that took Malik's arm off, in fact they have released fifteen species of shark in the lake, all with cameras on them to capture their horrific attacks on film. They have been inspired by the Discovery Channel's Shark Week and Faces of Death to film people being eaten by sharks to make a lot of money on a website, and worse comes when Sheriff Sabin (Donal Logue) is in cahoots with them as well. In the end of course the crazy villains get what they deserve, and the noticeable sharks in the lake are defeated, leaving Sara and Nick, along with their dog, as the last survivors, of course there is a leap out of the water by another shark. Also starring Damon Lipari as Keith. Being a B-movie the acting is obviously a bit cheesy and the scripting a little silly at times, the shark attacks helped out by the special effects and of course the 3D with things popping out at you are what keep you watching. I think that the critics were a little bit harsh to give this film one star out of five, it is not the worst film ever, I agree it not original, but you can't help but be intrigued a little by the villain plan, and of course the bloody gore is worth viewing, so for me it is an alright horror. Okay!
0 out of 0 found this helpful. Was this review helpful? Sign in to vote.
Permalink"
https://www.imdb.com/title/tt1633356/reviews?ref_=tt_ov_rt,4/10,Bites,galahad58-1,https://www.imdb.com/user/ur19897085/?ref_=tt_urv,1 February 2012,"0 out of 0 found this helpful. Was this review helpful? Sign in to vote.
Permalink",True,"It is criminal that someone actually was paid for this screenplay: a group of locals stock a lake with sharks to create their own reality show and they feed people to the sharks. Each shark has it's own camera and they have a live feed of the kills. Now -- not only is it a dumb idea, but also unbelievable: how could they get all of the sharks into the lake? How could they capture a big great white and haul it across the world to put into the lake? How could they even get the big sharks on their little tiny boat? Not only was the screenplay bad, but when one shark jumped out of the water to swallow a character (who was on a jetski) whole was the end of any credibility.
0 out of 0 found this helpful. Was this review helpful? Sign in to vote.
Permalink"
